[
  {
    "id": 2026080201,
    "word": "形式化验证",
    "pinyin": "xíng shì huà yàn zhèng",
    "field": "通用",
    "difficulty": "高",
    "pack": "每日热词",
    "publishedDate": "2026-08-02",
    "category": "科技",
    "simpleExplanation": "把证明或程序的每一步都翻译成机器能逐条核对的语言，让计算机替人检查有没有漏洞。",
    "lifeAnalogy": "像把手写账本录进记账软件，软件会自动逐笔核对，哪一步对不上立刻报错，而不是靠人眼扫一遍。",
    "practicalApplication": "芯片设计、航天与铁路控制系统靠它排查致命缺陷；OpenAI 也用 Lean 把 AI 生成的证明逐条验证后才对外公开。",
    "commonMisconception": "它只能保证“按写下的规则推导没错”，如果一开始的前提或目标就写偏了，验证再严也查不出来。",
    "definition": "用机器可检查的形式语言写出命题与推理并自动核验其正确性的方法；8月2日 OpenAI 公布 Astra 攻克十道数学难题，正是靠 Lean 形式化证明取信学界。"
  },
  {
    "id": 2026080202,
    "word": "缓存命中率",
    "pinyin": "huǎn cún mìng zhòng lǜ",
    "field": "通用",
    "difficulty": "中",
    "pack": "每日热词",
    "publishedDate": "2026-08-02",
    "category": "科技",
    "simpleExplanation": "要用的东西上次已经存好了、这次直接取来用的比例，比例越高速度越快、花钱越少。",
    "lifeAnalogy": "像点你常喝的那杯奶茶，店里已经提前备好料，不用从头熬煮，出餐又快又便宜。",
    "practicalApplication": "大模型 API 对重复的提示词按“命中缓存”打折，把固定的系统提示放在最前面，就能明显压低调用费用。",
    "commonMisconception": "命中率高不等于回答被写死不变，缓存复用的是重复的中间计算结果，模型每次仍会重新生成答案。",
    "definition": "请求所需数据能直接从缓存取到的比例，是衡量系统性能与成本的关键指标；DeepSeek-V4-Flash 以约98%的缓存命中折扣，把单任务成本压到同级模型的四成左右。"
  },
  {
    "id": 2026080203,
    "word": "球体堆积",
    "pinyin": "qiú tǐ duī jī",
    "field": "物理",
    "difficulty": "高",
    "pack": "每日热词",
    "publishedDate": "2026-08-02",
    "category": "科学",
    "simpleExplanation": "研究一堆同样大的球该怎么摆，才能最省空间、留下的缝隙最小。",
    "lifeAnalogy": "就像水果店摆橙子，一层层错开叠放，比横平竖直码放能多塞进去不少。",
    "practicalApplication": "它决定了晶体结构、材料密度和通信纠错码的效率，也被用来优化仓储装箱与快递打包方案。",
    "commonMisconception": "三维空间的最优摆法早有答案，真正难的是高维空间；那里人的空间直觉完全失效，绝不是“多加一维照着摆”。",
    "definition": "研究等大球体在空间中最密排列方式及其密度上界的数学问题；8月2日公布的 AI 新结果把一般维度上界推进至 Cohn–Elkies 阈值，是1978年以来的首次改进。"
  },
  {
    "id": 2026080204,
    "word": "合理使用",
    "pinyin": "hé lǐ shǐ yòng",
    "field": "通用",
    "difficulty": "中",
    "pack": "每日热词",
    "publishedDate": "2026-08-02",
    "category": "文化",
    "simpleExplanation": "在一些特定情形下，用别人的作品可以不经许可、不付费，但边界很严格。",
    "lifeAnalogy": "像上课时引用一段课文来讲解完全没问题，但把整本书印出来摆摊卖就不行了。",
    "practicalApplication": "写影评引用片段、做研究引用论文、学校少量复印教学资料，通常都落在合理使用的范围内。",
    "commonMisconception": "“只是拿来学习”并不自动等于合理使用，判断要看用途、用量以及是否抢走了原作的市场。",
    "definition": "著作权法中允许在特定条件下未经许可使用他人作品的例外规则；8月2日消息，德国慕尼黑法院裁定 AI 音乐公司 Suno 训练与生成两环节均侵权，认定该原则不适用。"
  },
  {
    "id": 2026080205,
    "word": "恐怖谷效应",
    "pinyin": "kǒng bù gǔ xiào yìng",
    "field": "心理学",
    "difficulty": "中",
    "pack": "每日热词",
    "publishedDate": "2026-08-02",
    "category": "心理",
    "simpleExplanation": "假人越像真人我们越有好感，但像到快分不清时，反而会突然觉得瘆得慌。",
    "lifeAnalogy": "卡通小熊让人觉得可爱，高仿真硅胶娃娃却让人后背发凉，好感度就是掉进了中间那道“谷”。",
    "practicalApplication": "做数字人、AI 演员和服务机器人时，会刻意保留一点风格化的“非真人感”，绕开这段反感区间。",
    "commonMisconception": "这不是因为做得不够精细，一味往真实方向堆细节，有时反而会掉进谷底更深处。",
    "definition": "仿真形象接近真人却仍存细微差异时，人们好感度骤降并产生不适的心理现象；AI 演员近日登上微博热搜，观众“表情空洞、太像人却不是人”的吐槽正源于此。"
  },
  {
    "id": 2026080206,
    "word": "职场霸凌",
    "pinyin": "zhí chǎng bà líng",
    "field": "心理学",
    "difficulty": "中",
    "pack": "每日热词",
    "publishedDate": "2026-08-02",
    "category": "社会",
    "simpleExplanation": "在工作场所里，有人靠职权或人多势众，长期打压、孤立、羞辱另一个人。",
    "lifeAnalogy": "像班里被集体孤立的同学，只是换到了办公室：不排班、不通知开会、当众挑刺，天天如此。",
    "practicalApplication": "认出它之后，可及时保存约谈记录、聊天截图与罚款单据，再向工会、劳动监察或司法途径求助。",
    "commonMisconception": "它不等于“领导要求严格”，区别在于是否针对特定个人、持续重复，且目的是贬损而非改进工作。",
    "definition": "在工作场所反复实施的孤立、羞辱、超额惩罚等权力压迫行为；8月2日热搜中一名59岁绿化工人被指“越级汇报”后遭连续约谈罚款并坠亡，警方已介入调查。"
  },
  {
    "id": 2026080207,
    "word": "原研药",
    "pinyin": "yuán yán yào",
    "field": "通用",
    "difficulty": "低",
    "pack": "每日热词",
    "publishedDate": "2026-08-02",
    "category": "健康",
    "simpleExplanation": "最早把这个药研发出来、做完整套临床试验的“原版药”，仿制药是后来照着做的。",
    "lifeAnalogy": "像一首歌的原唱和翻唱：原唱要从作词作曲到录音全做一遍，翻唱只要照着唱好就行。",
    "practicalApplication": "集采让原研药大幅降价中选后，患者在医院能用上原本价格高昂的进口原版药，自付明显减少。",
    "commonMisconception": "原研药不等于疗效一定更好，通过一致性评价的仿制药在质量与疗效上被要求与其等效。",
    "definition": "由原创企业首个研发上市、拥有完整临床数据的药品；7月31日第12批国家药品集采开标，65种药品全部采购成功，罕见地有10个原研药品种降价中选。"
  },
  {
    "id": 2026080208,
    "word": "综合融资成本",
    "pinyin": "zōng hé róng zī chéng běn",
    "field": "通用",
    "difficulty": "低",
    "pack": "每日热词",
    "publishedDate": "2026-08-02",
    "category": "财经",
    "simpleExplanation": "借一笔钱到底要多掏多少钱，把利息和各种手续费全算进去后的真实价格。",
    "lifeAnalogy": "像买机票，票面价再低也没用，加上税费、行李费、选座费之后的总价才是你真正付出的钱。",
    "practicalApplication": "8月1日起办理个人贷款，机构必须出具明示表，把利息、服务费和罚息折算成年化利率，方便你横向比价。",
    "commonMisconception": "广告里“日息万分之几”看着很低，折算成年化后可能高出许多，只盯单项利率极易被误导。",
    "definition": "借款人实际承担的利息与各类费用折算后的年化总成本；2026年8月1日起个人贷款须出具“综合融资成本明示表”，六大行已集体公示利率上限。"
  },
  {
    "id": 2026080209,
    "word": "逆周期调节",
    "pinyin": "nì zhōu qī tiáo jié",
    "field": "通用",
    "difficulty": "高",
    "pack": "每日热词",
    "publishedDate": "2026-08-02",
    "category": "财经",
    "simpleExplanation": "经济太冷时政府加把火，经济过热时踩一脚刹车，让起伏别那么剧烈。",
    "lifeAnalogy": "像给房间装空调：天冷开暖风，天热开冷气，目标是把温度稳在人体舒服的区间。",
    "practicalApplication": "它体现为降息降准、发专项债、扩大以旧换新和基建投资，直接影响房贷利率、就业机会和补贴力度。",
    "commonMisconception": "它不是“大水漫灌”，关键在于逆着经济周期方向发力并拿捏时机与力度，过量反而推高通胀与债务。",
    "definition": "政府按经济周期反方向调整财政与货币力度、以熨平经济波动的宏观政策思路；7月30日中央政治局会议部署下半年经济工作，强调加大逆周期调节并谋划增量政策。"
  },
  {
    "id": 2026080210,
    "word": "熔断机制",
    "pinyin": "róng duàn jī zhì",
    "field": "通用",
    "difficulty": "中",
    "pack": "每日热词",
    "publishedDate": "2026-08-02",
    "category": "财经",
    "simpleExplanation": "市场跌得太急时自动暂停交易一段时间，给所有人一点冷静下来的空档。",
    "lifeAnalogy": "像家里的空气开关，电流一超标就自动跳闸，宁可先断电，也不让电线烧起来。",
    "practicalApplication": "触发熔断时你无法买卖，所以做交易计划要预留极端行情下“想卖也卖不掉”的可能性。",
    "commonMisconception": "熔断只是暂停而非取消交易，它能压住恐慌蔓延，却改变不了下跌背后的基本面原因。",
    "definition": "当市场价格短时间内剧烈波动时自动暂停或限制交易的保护制度；受半导体股全球普跌影响，韩国股市早盘一度触发熔断，日经与纳指同步走弱。"
  }
]
