[
  {
    "id": 2026080401,
    "word": "AI偶像",
    "pinyin": "AI ǒu xiàng",
    "field": "通用",
    "difficulty": "中",
    "pack": "每日热词",
    "publishedDate": "2026-08-04",
    "category": "科技",
    "simpleExplanation": "用AI做出来的虚拟明星（动画角色、数字人），能唱歌拍戏接广告，而且不会像真人一样“塌房”闹出丑闻。",
    "lifeAnalogy": "就像一个永远不迟到、不耍大牌、不会酒驾被抓的“完美替身演员”，剧组请它最省心，资本也最爱。",
    "practicalApplication": "8月4日AI短剧女主“方桃子”凭“永不塌房”走红、60秒广告报价25.8万；理解它能帮你分辨网红经济里“真人”和“虚拟资产”的区别，也看懂资本为何追捧虚拟偶像。",
    "commonMisconception": "它不是“更便宜的真人”，而是由模型、人设和运营团队共同打造的IP；一旦被扒出背后真人代劳或价值观翻车，虚拟偶像同样会“塌房”。",
    "definition": "由AI生成形象与内容的虚拟演艺角色；2026年8月4日AI短剧女主“方桃子”以“永不塌房”标签走红并接商业广告，折射真人偶像风险下的资本转向。",
    "sourceUrl": "https://view.inews.qq.com/a/20260804A0ATS500"
  },
  {
    "id": 2026080402,
    "word": "斩杀线",
    "pinyin": "zhǎn shā xiàn",
    "field": "通用",
    "difficulty": "中",
    "pack": "每日热词",
    "publishedDate": "2026-08-04",
    "category": "科技",
    "simpleExplanation": "AI圈用来形容某款模型把价格和性能压到极致、直接“杀死”一堆同类竞争对手的那条性价比红线。",
    "lifeAnalogy": "像一家奶茶店把同款饮品压到3元还送杯，隔壁好几家撑不住关门——这个“3元”就是它的斩杀线。",
    "practicalApplication": "8月4日百度热搜“DeepSeek斩杀线”：V4 Flash每百万token仅2元、比Claude便宜约85倍，逼得OpenAI紧急降价；看懂它能判断哪家AI更划算、行业在洗牌。",
    "commonMisconception": "它不是“谁最便宜谁赢”的绝对真理——便宜背后可能是利润薄、服务少或能力有短板，选模型还要看稳定和适配，不能只看价格。",
    "definition": "AI领域形容某模型以极致性价比将同类竞品挤出市场的价格性能临界点；2026年8月DeepSeek V4 Flash以超低定价重塑大模型市场格局，引发行业降价潮。",
    "sourceUrl": "https://www.ccidnet.com/AIqqy/1122287.jhtml"
  },
  {
    "id": 2026080403,
    "word": "AI智能头盔",
    "pinyin": "AI zhì néng tóu kuī",
    "field": "通用",
    "difficulty": "低",
    "pack": "每日热词",
    "publishedDate": "2026-08-04",
    "category": "科技",
    "simpleExplanation": "外卖骑手戴的智能安全帽，里面装了语音助手，骑车不用手就能接单、联系顾客，还能一键求救。",
    "lifeAnalogy": "像给骑手配了个“随身秘书”，嘴上说一句“接单”，头盔就帮你搞定，手不用离开车把更安全。",
    "practicalApplication": "8月4日京东外卖发布AI智能头盔，首批免费发给全职骑手，带“单王带路”导航、SOS求助、商户环境核验；对普通人来说，这是AI从屏幕走进实体装备的缩影。",
    "commonMisconception": "它不是普通摄像头头盔去监视骑手，核心卖点是语音交互和安全守护；但也要关注它采集的位置、语音数据如何被保管。",
    "definition": "面向配送骑手的智能安全头盔，集成语音助手、路线导航、一键求助等功能；2026年8月4日京东外卖发布AI智能头盔并首批免费配发骑手。",
    "sourceUrl": "https://www.163.com/dy/article/L3FRKHJL0511CTRI.html"
  },
  {
    "id": 2026080404,
    "word": "无糖饮料",
    "pinyin": "wú táng yǐn liào",
    "field": "通用",
    "difficulty": "低",
    "pack": "每日热词",
    "publishedDate": "2026-08-04",
    "category": "财经",
    "simpleExplanation": "不加蔗糖、用代糖调味的饮料，这两年把传统含糖碳酸饮料挤下了超市冷柜的“C位”。",
    "lifeAnalogy": "像大家原来都爱吃糖，后来怕蛀牙改吃木糖醇口香糖——口味还在，但“糖”换成了不会长胖的替身。",
    "practicalApplication": "8月4日百度热搜“含糖碳酸饮料大势已去”：无糖饮料抢占商超冷柜核心位。看懂它能帮你做更健康的消费选择，也看清饮料行业的增长转向。",
    "commonMisconception": "“无糖”不等于“零热量”或“更健康就随便喝”，代糖仍有争议，长期大量喝无糖饮料也要适度，别被营销话术带偏。",
    "definition": "以代糖替代蔗糖的饮品；2026年8月“含糖碳酸饮料大势已去”登热搜，无糖饮料凭借健康叙事抢占商超核心陈列，重塑饮料市场格局。",
    "sourceUrl": "https://www.wuaishare.cn/tophub/hot?type=qqnews_hot"
  },
  {
    "id": 2026080405,
    "word": "REITs",
    "pinyin": "bù dòng chǎn xìn tuō jī jīn",
    "field": "通用",
    "difficulty": "中",
    "pack": "每日热词",
    "publishedDate": "2026-08-04",
    "category": "财经",
    "simpleExplanation": "一种把商场、产业园、高速公路这类能收租的物业打包成“基金份额”，让普通人也能当“包租公”的投资品。",
    "lifeAnalogy": "像几个人凑钱买下一栋楼收租金，再按出钱多少分月租；REITs就是把这栋楼切成很多小份公开发售。",
    "practicalApplication": "8月4日证监会透露正推进REITs纳入沪深港通，以后用A股账户也能买香港等地的REIT；想配置稳定现金流、分散风险的投资者可以多关注。",
    "commonMisconception": "它不等于“稳赚不赔的理财”——底层物业空置、利率变动都会影响分红和价格，它更像股票而非存款。",
    "definition": "不动产投资信托基金，将能产生稳定租金的地产资产证券化供公众投资；2026年8月4日证监会表示正推进REITs纳入沪深港通，拓宽跨境资产配置渠道。",
    "sourceUrl": "https://new.qq.com/rain/a/20260804A03PAO00"
  },
  {
    "id": 2026080406,
    "word": "暴雨预警",
    "pinyin": "bào yǔ yù jǐng",
    "field": "通用",
    "difficulty": "低",
    "pack": "每日热词",
    "publishedDate": "2026-08-04",
    "category": "科学",
    "simpleExplanation": "气象台预报接下来会下很大的雨、可能积水成灾，提前发信号让大家少出门、防内涝。",
    "lifeAnalogy": "像小区物业在业主群喊“今晚水管要爆，请挪车收衣服”，提前知道总比淋成落汤鸡强。",
    "practicalApplication": "8月4日中央气象台继续发布暴雨黄色预警，京津冀、广东等地有大到暴雨；看到预警就提前收阳台、绕开积水路段、取消山区行程最稳妥。",
    "commonMisconception": "预警分蓝黄橙红，不是“有预警就停课停工”，要看本地发布的响应级别和具体指示，黄色一般是以防范为主。",
    "definition": "气象部门对强降雨及其内涝、山洪等次生灾害的提前分级警示；2026年8月4日中央气象台发布暴雨黄色预警，京津冀、华南等多地有大到暴雨。",
    "sourceUrl": "https://news.qq.com/rain/a/20260804A03H6W00"
  },
  {
    "id": 2026080407,
    "word": "牛蛙抗生素",
    "pinyin": "niú wā kàng shēng sù",
    "field": "通用",
    "difficulty": "低",
    "pack": "每日热词",
    "publishedDate": "2026-08-04",
    "category": "健康",
    "simpleExplanation": "有些牛蛙在养殖和流通过程中被查出抗生素残留超标，吃多了可能对身体不好，是近期的食品安全热点。",
    "lifeAnalogy": "像买猪肉发现瘦肉精超标一样，本来是进补的食材，暗藏不该有的药物残留，让人不放心。",
    "practicalApplication": "8月4日“牛蛙抗生素”持续发酵，福建、广东多地封存送检、电商平台下架问题商品；点外卖吃蛙类时认准正规商家，留意抽检通报更安心。",
    "commonMisconception": "它不是说“所有牛蛙都不能吃”，而是部分链条把关缺失的批次有问题；充分加热、选可追溯的正规渠道就能大幅规避风险。",
    "definition": "牛蛙养殖与流通环节出现的抗菌药物残留超标现象；2026年8月3日多地通报牛蛙产品抗生素超标并封存送检，电商平台下架问题商品，引发食安关注。",
    "sourceUrl": "https://m.gmw.cn/2026-08/03/content_1304542233.htm"
  },
  {
    "id": 2026080408,
    "word": "逆反心理",
    "pinyin": "nì fǎn xīn lǐ",
    "field": "心理学",
    "difficulty": "中",
    "pack": "每日热词",
    "publishedDate": "2026-08-04",
    "category": "社会",
    "simpleExplanation": "你越不让做的事，人反而越想去做——被限制自由时，心里那股“偏不”的抵触劲儿就是逆反心理。",
    "lifeAnalogy": "像小时候家长越说“不许吃糖”，你越偷偷塞一颗；越是“捂嘴”的梗，网友越想转发玩。",
    "practicalApplication": "8月4日“竹知了事件”刷屏：一家科技巨头投诉下架网友调侃的小玩具，反而激起全民逆反、争相二创；懂它能帮你做沟通、管理时少踩“越压越反弹”的坑。",
    "commonMisconception": "它不是“人天生爱抬杠”，而是一种对控制感的本能保护；用疏导和共情替代强硬压制，逆反往往会自然消解。",
    "definition": "个体在自由受限或被强制时产生对立抵触的心理反应；2026年8月“竹知了事件”中企业投诉下架网友调侃反致全民二创，是逆反心理的典型社会样本。",
    "sourceUrl": "https://www.163.com/dy/article/L3FCD07A0553TB9L.html"
  },
  {
    "id": 2026080409,
    "word": "临时好友",
    "pinyin": "lín shí hǎo yǒu",
    "field": "通用",
    "difficulty": "低",
    "pack": "每日热词",
    "publishedDate": "2026-08-04",
    "category": "社会",
    "simpleExplanation": "大家呼吁微信出的一种“加一下、办完事就删”的轻量关系，用来传文件、收红包又不用真把对方留进通讯录。",
    "lifeAnalogy": "像去快递柜取件，扫码开柜拿完就走，不必跟柜子“加好友”——办事归办事，不必硬塞进朋友圈。",
    "practicalApplication": "8月4日“微信能不能出临时好友”冲上热搜，微信官方回应扫码传文件、面对面收红包等不加好友也能用的功能；它反映了大家对“社交减负”的渴望。",
    "commonMisconception": "它不是要取代真朋友，而是补一个“低负担临时连接”的缺口；真正的亲密关系仍需要长期、稳定的往来，功能替代不了人情。",
    "definition": "网友呼吁的一种轻量、可随时解除的临时社交关系，用于一次性协作而不侵入常驻好友列表；2026年8月4日“微信临时好友功能”呼声登上微博热搜。",
    "sourceUrl": "https://view.inews.qq.com/a/20260804A09E4R00"
  },
  {
    "id": 2026080410,
    "word": "松弛感",
    "pinyin": "sōng chí gǎn",
    "field": "通用",
    "difficulty": "低",
    "pack": "每日热词",
    "publishedDate": "2026-08-04",
    "category": "文化",
    "simpleExplanation": "一种不紧绷、不内耗、从容自在的状态，是这两年大家从“拼命卷”转向“好好休息”的流行心态。",
    "lifeAnalogy": "像周末泡杯茶发呆也不觉得“浪费时间”，不再时刻盯着待办清单，身心都松下来那种舒服。",
    "practicalApplication": "8月暑期“低消耗、慢生活、养身心”成主流趋势，年轻人从打卡式旅游转向山野静养；理解它帮你给自己减负，少点焦虑、多点接纳。",
    "commonMisconception": "它不是“躺平摆烂”——松弛感是努力过后能放下、有节奏地生活，而非放弃目标和责任。",
    "definition": "从容不焦虑、接纳当下的心理状态与生活态度；2026年8月全网热点综述显示，“低消耗慢生活、养身心”成为年轻人主流心态，松弛感持续出圈。",
    "sourceUrl": "https://www.toutiao.com/article/7669366301277766167/"
  }
]
