[
  {
    "id": 2026081401,
    "word": "AI隐形水印",
    "pinyin": "AI yǐn xíng shuǐ yìn",
    "field": "通用",
    "difficulty": "中",
    "pack": "每日热词",
    "publishedDate": "2026-08-14",
    "category": "科技",
    "simpleExplanation": "Anthropic 给 Claude 生成的内容偷偷打上肉眼看不见、改词也洗不掉的标记，相当于给 AI 内容发了张“身份证”。",
    "lifeAnalogy": "像在钞票纸里藏了防伪线，肉眼看不出，但验钞机一照就知道真假；AI 内容以后也能被“验”出来谁生成的。",
    "practicalApplication": "普通用户学会识别 AI 生成内容、保护原创；平台和企业按欧盟《AI法案》做内容溯源，判断信息能不能信、该谁负责。",
    "commonMisconception": "它不是“可见水印”——肉眼完全看不到，也不靠在图上写字，而是藏在文件数据里的隐蔽标记，简单复制粘贴也去不掉。",
    "definition": "对 AI 生成内容嵌入肉眼不可见、难以去除的标识的技术；2026年8月14日 Anthropic 为 Claude 全产品强制启用隐形水印，以遵守欧盟《AI法案》对 AI 内容溯源的要求。",
    "sourceUrl": "https://new.qq.com/rain/a/20260814A03DGT00?refer=cp_1009"
  },
  {
    "id": 2026081402,
    "word": "智能体技能",
    "pinyin": "zhì néng tǐ jì néng",
    "field": "通用",
    "difficulty": "中",
    "pack": "每日热词",
    "publishedDate": "2026-08-14",
    "category": "科技",
    "simpleExplanation": "把 AI 智能体会做的某件事（比如读 PDF、做表格）写成一份可复用的“说明书”，谁都能装上、分享、组合着用。",
    "lifeAnalogy": "像给新员工一本标准操作手册（SOP），照着做就能上岗；不同手册拼起来，就能干更复杂的活。",
    "practicalApplication": "开发者把重复工作封装成“技能包”共享复用；企业搭内部技能库提升 AI 办事效率；普通人理解 AI 从“会聊天”到“有专业本领”。",
    "commonMisconception": "它不是又一个大模型——技能只是“文件夹+说明文件”，靠调用已有模型来干活，重点是把知识模块化、可移植，而不是堆参数。",
    "definition": "将 AI 智能体的专业能力封装为可复用、可共享、跨平台加载的模块化单元的标准；2026年8月 Anthropic 开源 Agent Skills 框架，发布一天 GitHub 星标逾 16 万，推动智能体能力像 npm 包一样流通。",
    "sourceUrl": "https://www.anthropic.com/engineering/equipping-agents-for-the-real-world-with-agent-skills"
  },
  {
    "id": 2026081403,
    "word": "小模型",
    "pinyin": "xiǎo mó xíng",
    "field": "通用",
    "difficulty": "中",
    "pack": "每日热词",
    "publishedDate": "2026-08-14",
    "category": "科技",
    "simpleExplanation": "一种只有十几 MB、能塞进手机和廉价芯片里本地运行的迷你 AI，专做一件小事，不联网也能用。",
    "lifeAnalogy": "像电饭煲——不像全能厨师机，但煮饭又快又省电；小模型不跟你闲聊，只可靠地把一句话变成“关灯”“开空调”这种动作。",
    "practicalApplication": "理解端侧 AI 趋势：手表、家电、传感器都能本地跑 AI，省流量、保隐私、不依赖云端算力；选型时知道“不是越大越好”。",
    "commonMisconception": "它不等于“能力缩水的大模型”——小模型是主动砍掉闲聊和百科知识、专攻工具调用的特化模型，在它那一件事上反而又快又稳。",
    "definition": "参数量仅数千万、体积可压到十几 MB、能在微控制器等端侧设备本地运行的特化 AI 模型；2026年8月 Cactus Compute 推出 14MB 的 Needle 2，可在 ESP32 上离线完成工具调用与设备控制。",
    "sourceUrl": "https://www.techradar.com/pro/the-next-age-of-llms-dev-gets-a-small-llm-running-at-10-tokens-a-second-locally-on-a-usd10-microcontroller"
  },
  {
    "id": 2026081404,
    "word": "红灯停表",
    "pinyin": "hóng dēng tíng biǎo",
    "field": "通用",
    "difficulty": "低",
    "pack": "每日热词",
    "publishedDate": "2026-08-14",
    "category": "社会",
    "simpleExplanation": "外卖平台让骑手等红灯的时间不算进送餐考核，红灯“暂时停表”，不再因堵车被扣钱。",
    "lifeAnalogy": "像考试时老师故意喊“停笔，先发卷”，等突发状况过去再接着计时，不让骑手为不能控制的事买单。",
    "practicalApplication": "理解平台算法开始向劳动者“留余地”；消费者看到配送更合理；从业者关注各地试点，判断算法治理是否真正落地。",
    "commonMisconception": "它不是“送餐不限时”——只是把等红灯这类不可控等待从考核里剔除，正常路程时间仍计时，目的是减少无效催促。",
    "definition": "外卖平台在骑手等红灯等不可控等待时暂停配送计时、顺延考核时长的机制；2026年8月13日北京三平台宣布“红灯停表”，9月先在朝阳等区试运行。",
    "sourceUrl": "https://new.qq.com/rain/a/20260814A03E1K00?refer=cp_1009"
  },
  {
    "id": 2026081405,
    "word": "新官理旧账",
    "pinyin": "xīn guān lǐ jiù zhàng",
    "field": "通用",
    "difficulty": "中",
    "pack": "每日热词",
    "publishedDate": "2026-08-14",
    "category": "社会",
    "simpleExplanation": "多地立规矩：领导换人了，前任留下的历史问题也要列清单交接清楚，新官不能装没看见就甩锅。",
    "lifeAnalogy": "像租房交接要写清水电、家具清单并双方签字，不能前任搬走、后任说“这破沙发不是我的”，东西坏了没人认。",
    "practicalApplication": "看懂干部离任审计与交接制度；普通市民可关注本地是否“击鼓传花”式甩锅，理解政策连续性和正确政绩观。",
    "commonMisconception": "它不是“新官替旧官背锅”——而是把历史欠账、风险隐患写进清单、明确责任，防止问题被藏着拖黄、断了档。",
    "definition": "通过清单式交接制度，要求离任干部把历史遗留问题、风险隐患列明移交、接任者认领办理的治理机制；2026年8月中新网报道江西、云南、广东等多地已出台新规。",
    "sourceUrl": "https://m.chinanews.com/wap/detail/cht/zw/10677023.shtml"
  },
  {
    "id": 2026081406,
    "word": "买断式逆回购",
    "pinyin": "mǎi duàn shì nì huí gòu",
    "field": "通用",
    "difficulty": "中",
    "pack": "每日热词",
    "publishedDate": "2026-08-14",
    "category": "财经",
    "simpleExplanation": "央行一次性把债券买下来、约定以后卖回，等于先“借钱”给市场又拿债券压着，向市场大笔撒流动性。",
    "lifeAnalogy": "像你先把邻居的二手车买下、说好下月原价卖回，钱先给邻居周转，车押你这——既借出钱又拿抵押物。",
    "practicalApplication": "理解央行如何调节市场“钱紧不紧”；投资者看利率与债市走向；企业判断融资环境冷暖，安排资金。",
    "commonMisconception": "它和普通逆回购相反——央行是“先买后卖”主动放钱，不是“先卖后买”回笼钱；8月14日这轮规模达1万亿元、期限6个月。",
    "definition": "央行以固定数量、利率招标方式买入债券并约定未来卖出的操作，一次性向市场投放基础货币；2026年8月14日央行开展10000亿元6个月买断式逆回购以保持流动性充裕。",
    "sourceUrl": "https://www.163.com/dy/article/L4938OKS0524VF0A.html"
  },
  {
    "id": 2026081407,
    "word": "AI数据平台",
    "pinyin": "AI shù jù píng tái",
    "field": "通用",
    "difficulty": "中",
    "pack": "每日热词",
    "publishedDate": "2026-08-14",
    "category": "财经",
    "simpleExplanation": "专门帮企业存数据、洗数据、搭 AI 应用的一站式平台；投资人疯抢，把它当成 AI 时代的“水电煤”基础设施。",
    "lifeAnalogy": "像给所有工厂供自来水的水厂——各家公司不用自己打井，接上水管就能用干净水，Databricks 就是 AI 界的“水厂”。",
    "practicalApplication": "看懂 AI 产业链哪里最赚钱（数据+基础设施）；投资者判断赛道估值；企业选型数据平台、算清上云与自建成本。",
    "commonMisconception": "它不只是“数据库”——还整合数据治理、AI 训练与智能体运行，2026年8月 Databricks 融资50亿美元、估值1900亿美元，卖的是“数据+AI”整体能力。",
    "definition": "为企业提供数据存储、治理、分析与 AI 应用构建的一体化软件平台；2026年8月14日 Databricks 完成50亿美元融资、估值升至1900亿美元，折射 AI 数据基础设施成为资本新宠。",
    "sourceUrl": "https://gu.qq.com/resources/shy/news/detail-v2/index.html?t=1#/index?_tentrees_trans=0&id=SN2026081410091094d6f82f"
  },
  {
    "id": 2026081408,
    "word": "床车露营",
    "pinyin": "chuáng chē lù yíng",
    "field": "通用",
    "difficulty": "低",
    "pack": "每日热词",
    "publishedDate": "2026-08-14",
    "category": "生活",
    "simpleExplanation": "把新能源车后排放平铺床垫，晚上停在服务区或湖边睡车里，省下酒店钱、还能外放电做饭看电影的旅行方式。",
    "lifeAnalogy": "像把家“装”进车里到处跑——车既是卧室又是厨房，不用订房退房，走到哪住到哪，比住酒店自由还省钱。",
    "practicalApplication": "自驾游省钱攻略：规划充电路线、驻车点；理解为何今年暑期经济型酒店入住率下滑；判断自己适不适合这种“移动住宿”。",
    "commonMisconception": "它不是“全面取代酒店”——多是分流价格敏感客群，家庭亲子、追求品质的仍住酒店；且受天气、洗漱、安全等条件限制。",
    "definition": "驾驶新能源车放平座椅、铺床垫在车内过夜，并借外放电功能解决照明做饭的露营式旅行；2026年暑期“床车旅行”播放量破98亿，被指分流传统酒店客源。",
    "sourceUrl": "https://www.sina.cn/news/article/nimfmym3588779.html"
  },
  {
    "id": 2026081409,
    "word": "恒星日",
    "pinyin": "héng xīng rì",
    "field": "通用",
    "difficulty": "中",
    "pack": "每日热词",
    "publishedDate": "2026-08-14",
    "category": "科学",
    "simpleExplanation": "地球相对遥远星星自转一圈的真实时间，约23小时56分4秒，比我们过的24小时“一天”短了大约4分钟。",
    "lifeAnalogy": "像你绕操场跑一圈看远处大树（恒星日）和看正前方的旗杆（太阳日）；因为边跑边被推着转了点，看旗杆要多跑几步。",
    "practicalApplication": "理解昼夜长短、时差与天文导航；看懂卫星、望远镜为何用恒星时定位；应对“一天到底是24小时吗”这类科普疑问。",
    "commonMisconception": "“一天24小时”是太阳日不是真实自转周期——地球一边自转一边绕太阳公转，要多转约1°才再次对准太阳，所以太阳日比恒星日长约4分钟。",
    "definition": "以遥远恒星为参考、地球同一经线两次对准同一恒星的时间间隔，即地球真正自转一周，时长23小时56分4秒；日常24小时制是更长的太阳日。",
    "sourceUrl": "https://baike.baidu.com/view/25969.htm"
  },
  {
    "id": 2026081410,
    "word": "史低价",
    "pinyin": "shǐ dī jià",
    "field": "通用",
    "difficulty": "低",
    "pack": "每日热词",
    "publishedDate": "2026-08-14",
    "category": "文化",
    "simpleExplanation": "某个商品或游戏降到它上市以来的最低价，网友管这最低点叫“史低”，是大家蹲守抄底的信号。",
    "lifeAnalogy": "像超市贴“全年最低价”的大红标签，你等了一整年就想趁这波把心仪的东西拿下，错过要再等很久。",
    "practicalApplication": "买游戏、数码、日用品前先查是否“史低”再下手，避免买贵；商家用“史低”制造紧迫感促销，消费者学会识别真假优惠。",
    "commonMisconception": "“史低”不等于“最划算”——可能只是相对它自己以前贵的时候便宜，横向比别家未必最低；且部分“史低”限时短、先涨后降。",
    "definition": "某一商品或游戏自上市以来的历史最低售价；2026年8月12日《黑神话：悟空》全平台开启七折，标准版降至187.6元创发售以来史低，引发玩家“背刺”讨论。",
    "sourceUrl": "https://dy.163.com/article/L44EBJ320511B8LM.html"
  }
]
