[
  {
    "id": 2026081301,
    "word": "AI数字员工",
    "pinyin": "AI shù zì yuán gōng",
    "field": "通用",
    "difficulty": "中",
    "pack": "每日热词",
    "publishedDate": "2026-08-13",
    "category": "科技",
    "simpleExplanation": "一种能自己登录你的账号、跨应用帮你跑流程办成事的AI助手，像永远在线不下班的数字同事。",
    "lifeAnalogy": "像公司里那种“你交代一句，他就自己打开邮箱、订票、填表把事办妥”的得力助理，不用你一步步盯着。",
    "practicalApplication": "订行程、报销、客服、写报告都能交给它；普通人理解“AI从只能聊天变成能办事”，判断哪些事可以放心放手给它。",
    "commonMisconception": "它不是真有“员工编制”——本质还是调用工具执行任务的智能体，出错、越权、泄露隐私的风险仍在，关键操作仍需人把关。",
    "definition": "能登录用户已有工具、跨应用自主完成任务的AI代理产品；2026年8月SpaceXAI推出Grok Bot、飞猪等上线旅行AI，行业从“会聊天”竞争转向“能办事”的执行权争夺。",
    "sourceUrl": "https://so.html5.qq.com/page/real/search_news?docid=70000021_0586a7cfc7957852"
  },
  {
    "id": 2026081302,
    "word": "开源权重模型",
    "pinyin": "kāi yuán quán zhòng mó xíng",
    "field": "通用",
    "difficulty": "高",
    "pack": "每日热词",
    "publishedDate": "2026-08-13",
    "category": "科技",
    "simpleExplanation": "厂商把训练好的AI模型“权重”免费公开下载，谁都能拿去本地部署、改造成自己的，不再被一家公司锁死。",
    "lifeAnalogy": "像餐厅不仅卖做好的菜，还把祖传配方公开，你回家能照着做、还能按口味改，不必每次都回它家买。",
    "practicalApplication": "企业和开发者用开源权重做私有化部署、保护数据、降本；普通用户理解“开源”与“开放API调用”的区别，选模型更自主。",
    "commonMisconception": "它不等于“源代码全公开”——很多“开源权重”只放模型参数、不放训练代码，和真正开源软件不是一回事。",
    "definition": "厂商公开训练好的模型参数权重、允许自由下载与本地部署的AI模型形态；2026年8月DeepSeek V4 Pro、阿里Qwen3.8、Meta Muse Glimmer密集开放权重，中国自研开源模型下载占比首超美国。",
    "sourceUrl": "https://so.html5.qq.com/page/real/search_news?docid=70000021_5406a7d36b740252"
  },
  {
    "id": 2026081303,
    "word": "CPO共封装光学",
    "pinyin": "CPO gòng fēng zhuāng guāng xué",
    "field": "通用",
    "difficulty": "中",
    "pack": "每日热词",
    "publishedDate": "2026-08-13",
    "category": "科技",
    "simpleExplanation": "把光芯片和电脑芯片“打包”封在一起的技术，让数据用光而不是电来传，又快又省电。",
    "lifeAnalogy": "像把发电厂和用电的工厂盖在同一栋楼里，省掉长长的输电线，既少损耗又跑得快。",
    "practicalApplication": "看懂AI算力、光通信板块为何暴涨；评估数据中心功耗与成本，理解“电进光进”的产业升级方向。",
    "commonMisconception": "它不是普通“光模块”——CPO把光学器件直接封到芯片旁边，比可插拔光模块更紧凑高效，是新一代而非简单替代。",
    "definition": "将光引擎与交换芯片共封装、以光互连替代部分电互连的通信技术；2026年8月13日A股光芯片、CPO方向领涨，算力硬件产业链走强使其成为AI数据中心降功耗的关键路径。",
    "sourceUrl": "https://www.163.com/dy/article/L473R74O0514R9P4.html"
  },
  {
    "id": 2026081304,
    "word": "苹果AI收费",
    "pinyin": "píng guǒ AI shōu fèi",
    "field": "通用",
    "difficulty": "低",
    "pack": "每日热词",
    "publishedDate": "2026-08-13",
    "category": "财经",
    "simpleExplanation": "苹果准备让iPhone的AI功能（比如智能摘要）和付费云存储绑在一起卖，想多用AI可能得加钱升级套餐。",
    "lifeAnalogy": "像视频会员，基础版能看，但要享“高清+多设备”的AI智能体验，得掏钱升到更高级的套餐。",
    "practicalApplication": "消费者算清“AI值不值这个价”；投资者看AI订阅如何成为手机厂新收入，理解“AI免费时代”正在结束。",
    "commonMisconception": "收费不等于“所有AI都不能用”——基础能力多仍免费，主要是高级摘要、多设备等功能与iCloud+套餐挂钩。",
    "definition": "智能手机制造商将AI功能与云存储订阅捆绑、对高级能力收费的商业模式；2026年8月iOS 27测试版显示AI摘要与iCloud+套餐挂钩，标志消费级AI免费时代走向终结。",
    "sourceUrl": "https://new.qq.com/rain/a/20260813A03NZH00?refer=cp_1009"
  },
  {
    "id": 2026081305,
    "word": "美国囤铜",
    "pinyin": "měi guó dùn tóng",
    "field": "通用",
    "difficulty": "中",
    "pack": "每日热词",
    "publishedDate": "2026-08-13",
    "category": "财经",
    "simpleExplanation": "美国趁关税还没落地，7月一口气运进20万吨铜刷新纪录，赌以后会更贵，先低价囤起来。",
    "lifeAnalogy": "像听说下月汽油要涨价，大家这个月拼命把油箱灌满、还借仓库囤油，赶在涨价前锁住低价。",
    "practicalApplication": "理解大宗商品的“关税套利”；关注铜价对空调、电线、电动车成本的影响，看懂资源博弈如何推高制造业价格。",
    "commonMisconception": "它不只是“美国自己用得多”——主因是纽约与伦敦铜价差超350美元/吨的套利空间，叠加未来关税预期，是金融博弈而非纯粹需求。",
    "definition": "贸易商趁美国精炼铜关税未落地、利用跨市场价差提前大量进口囤积的行为；2026年7月约20万吨精炼铜运抵美国创纪录，全球可见铜库存约64%集中美国，人为加剧海外短缺。",
    "sourceUrl": "https://www.21jingji.com/article/20260804/herald/d332f2996d582ed9b6a44c4adc4050d5.html"
  },
  {
    "id": 2026081306,
    "word": "美债40万亿",
    "pinyin": "měi zhài 40 wàn yì",
    "field": "通用",
    "difficulty": "中",
    "pack": "每日热词",
    "publishedDate": "2026-08-13",
    "category": "财经",
    "simpleExplanation": "美国欠的钱第一次超过40万亿美元，平均每个美国人背了约11万美元的债，利息支出已超军费。",
    "lifeAnalogy": "像一个信用卡刷爆的人，每月工资有近四分之一先拿去还利息，本金一分没还，还越借越多。",
    "practicalApplication": "理解美元信用、全球利率和资产配置；看懂为何美债利率走高会压住股市、黄金和汇率，判断理财风险。",
    "commonMisconception": "突破40万亿不是“某天突然借的”——从39万亿到40万亿只用了几个月，是长期借新还旧、利息滚雪球加速的结果。",
    "definition": "美国联邦政府未偿债务总额于2026年8月初首次突破40万亿美元，债务与GDP之比约123%远超警戒线，年净利息首破1万亿美元并超过国防预算，引发全球金融稳定担忧。",
    "sourceUrl": "https://gu.qq.com/resources/shy/news/detail-v2/index.html?t=1#/index?_tentrees_trans=0&id=SN2026081218484594d45ef4"
  },
  {
    "id": 2026081307,
    "word": "带薪错峰休假",
    "pinyin": "dài xīn cuò fēng xiū jià",
    "field": "通用",
    "difficulty": "低",
    "pack": "每日热词",
    "publishedDate": "2026-08-13",
    "category": "社会",
    "simpleExplanation": "河南等多地出新招：鼓励单位周五下午提前走、把年假和周末拼成短途游，让大家别都挤长假出门。",
    "lifeAnalogy": "像错峰用电——大家都半夜洗衣服比白天便宜还不跳闸，休假也分散开，景区不挤、钱包也更划算。",
    "practicalApplication": "上班族据此规划“周五半天+周末+年假”的小长假；企业HR落实休假权益；理解政策如何把闲暇变成消费动力。",
    "commonMisconception": "它不是“强制多放假”——而是引导错峰、保障应休尽休，领导干部带头，未休假按日工资300%补偿，重在落地而非简单加天数。",
    "definition": "多地推动的带薪年休假灵活安排制度，鼓励“周五半天+周末+年假”拼假错峰出游；2026年8月河南六部门发文，意在缓解旅游潮汐、激活淡季消费并保障劳动者休假权。",
    "sourceUrl": "https://m.chinanews.com/wap/detail/cht/zw/10672559.shtml"
  },
  {
    "id": 2026081308,
    "word": "殡葬专业",
    "pinyin": "bìn zàng zhuān yè",
    "field": "通用",
    "difficulty": "中",
    "pack": "每日热词",
    "publishedDate": "2026-08-13",
    "category": "社会",
    "simpleExplanation": "大学里学遗体整容、火化、陵园管理的专业；今年有考生分数不高却被录取，因为听说这行就业稳、好找工作。",
    "lifeAnalogy": "像以前被人嫌弃的“苦差事”手艺活，随着老龄化需求变大，反而成了抢手的铁饭碗，待遇和地位都水涨船高。",
    "practicalApplication": "考生和家长看专业别只盯热门，结合就业与兴趣；理解老龄化如何改变职业冷热，破除对“冷门”专业的偏见。",
    "commonMisconception": "它不等于“毕业就去干殡仪馆杂活”——现代殡葬专业含殡仪服务、遗体防腐整容、陵园设计等，技术含量高，且入行有严格规范与心理要求。",
    "definition": "高等教育中培养遗体防腐整容、火化设备、殡仪服务与陵园管理人才的专业；2026年8月河南一考生高考444分被殡葬专业录取引热议，折射老龄化下的就业新选择。",
    "sourceUrl": "https://new.qq.com/rain/a/20260813A03JTY00?refer=cp_1009"
  },
  {
    "id": 2026081309,
    "word": "就业换挡",
    "pinyin": "jiù yè huàn dǎng",
    "field": "通用",
    "difficulty": "中",
    "pack": "每日热词",
    "publishedDate": "2026-08-13",
    "category": "社会",
    "simpleExplanation": "当下就业市场正在“换挡”：有人接受上四休三但降薪，有技术师傅跑去送外卖，高分考生放弃名校选警校。",
    "lifeAnalogy": "像开车从高速档换到经济档——速度慢了但更省油稳当，整个劳动力市场都在重新找平衡。",
    "practicalApplication": "求职者重新评估“稳定 vs 收入 vs 性价比”；企业调整用工与薪酬；普通人理解经济换挡期职业选择为何变谨慎。",
    "commonMisconception": "“技术骨干跑外卖”不是“手艺没用”——是技能变现渠道与报酬体系错配，背后是降本增效下普通人才华与机会的重新摆位。",
    "definition": "经济换挡期就业市场出现的结构性变化，表现为上四休三降薪、技术工人转行送外卖、考生弃985选警校等现象；2026年8月多话题冲上热搜，反映就业性价比与错配之痛。",
    "sourceUrl": "https://luckpiao.com/11617"
  },
  {
    "id": 2026081310,
    "word": "食用色素",
    "pinyin": "shí yòng sè sù",
    "field": "通用",
    "difficulty": "中",
    "pack": "每日热词",
    "publishedDate": "2026-08-13",
    "category": "健康",
    "simpleExplanation": "加到食物里调颜色的添加剂；深色网红蛋糕为显色可能猛加色素，吃多伤肝肾，小孩更要少碰。",
    "lifeAnalogy": "像给白墙刷漆，刷一两层没事，可要是整桶倒上去还反复刷，墙皮和住在屋里的人都要遭殃。",
    "practicalApplication": "买裱花蛋糕看配料、挑天然上色（可可粉、墨鱼汁）；家长控制儿童高频食用，优先天然食材，读懂食品标签。",
    "commonMisconception": "“偶尔吃一块黑蛋糕”一般不会超标——真正要警惕的是长期大量吃，以及蛋糕本身高糖高脂的负担，别只盯着色素。",
    "definition": "为改善食品色泽而添加的人工或天然着色剂；2026年8月“不建议买深色蛋糕”上热搜，专家指合成色素有国标限量（如亮蓝≤25mg/kg），体重越小耐受越低、儿童需严控。",
    "sourceUrl": "https://www.thepaper.cn/newsDetail_forward_33763999?commTag=true"
  }
]