[
  {
    "id": 2026080601,
    "word": "自研AI芯片",
    "pinyin": "zì yán AI xīn piàn",
    "field": "通用",
    "difficulty": "中",
    "pack": "每日热词",
    "publishedDate": "2026-08-06",
    "category": "科技",
    "simpleExplanation": "一家做AI的公司不再只买别人的芯片，而是自己招人设计专属于自家大模型的芯片。",
    "lifeAnalogy": "像一个只会点外卖的厨师，终于自己盖了厨房、按自家招牌菜定做了专属灶台，出菜又快又省。",
    "practicalApplication": "开发者可关注自研芯片带来的更低推理成本；投资者看算力自主化趋势；普通人理解为“国产AI不再被卡脖子”的关键一步。",
    "commonMisconception": "自研芯片不等于彻底不用英伟达，头部公司多采取“自研+外采”的多芯片策略，目的是分散供应、定制优化，而非全面替换。",
    "definition": "大模型厂商为自家AI模型专门设计定制芯片、实现软硬件协同以提升效率的战略；2026年8月6日Anthropic首次公开确认组建内部半导体团队为Claude研发专用AI芯片，此前OpenAI、Meta也已下场造芯。",
    "sourceUrl": "https://ai.zol.com.cn/1227/12274548.html"
  },
  {
    "id": 2026080602,
    "word": "Vibe Coding",
    "pinyin": "fēn wéi biān chéng",
    "field": "通用",
    "difficulty": "中",
    "pack": "每日热词",
    "publishedDate": "2026-08-06",
    "category": "科技",
    "simpleExplanation": "你用大白话告诉AI想做什么，AI就帮你把代码写出来，你只需看懂并改改。",
    "lifeAnalogy": "像你跟裁缝说“我要件蓝色宽松外套”，裁缝直接做出来，你试穿后让ta微调，而不是自己踩缝纫机。",
    "practicalApplication": "不会写代码的人能快速做个小工具；程序员把重复编码交给AI、专注架构与审核，整体提效。",
    "commonMisconception": "它不等于“完全不用懂编程”，AI写的代码可能有bug或安全隐患，仍需人来审核、测试和把关。",
    "definition": "一种由AI生成代码、人用自然语言描述意图并负责审查修正的新型编程方式；2026年8月腾讯高管称今年大部分代码由AI生成，谷歌、Meta等也披露高比例AI写码，程序员加速转向“审核者”角色。",
    "sourceUrl": "https://www.aastocks.com/sc/stocks/news/aafn-con/now.1527721/positive-news/aafn"
  },
  {
    "id": 2026080603,
    "word": "反网络暴力法",
    "pinyin": "fǎn wǎng luò bào lì fǎ",
    "field": "通用",
    "difficulty": "低",
    "pack": "每日热词",
    "publishedDate": "2026-08-06",
    "category": "社会",
    "simpleExplanation": "国家专门立的一部法，用来管住网上骂人、人肉、造谣这些伤害别人的行为。",
    "lifeAnalogy": "像给网络这个大广场配了保安和规矩，谁在里头打人骂人、曝光别人隐私，都要被依法拦下和追责。",
    "practicalApplication": "遇到被网暴、被“开盒”可依法维权、申请禁令；平台要装预警和一键取证；普通网友也懂边界，不跟风施暴。",
    "commonMisconception": "它不是已经正式生效的法律，而是2026年7月29日公布的征求意见稿，8月28日前仍在向社会征求意见，尚待最终通过。",
    "definition": "国家网信办会同有关部门起草、于2026年7月29日公布征求意见的《中华人民共和国反网络暴力法（征求意见稿）》，共七章六十条，首次从国家法律层面系统界定网暴、压实平台责任、破解取证维权难，8月6日获主流媒体集中解读。",
    "sourceUrl": "http://www.jyb.cn/rmtzcg/xwy/wzxw/202608/t20260806_2111507990.html"
  },
  {
    "id": 2026080604,
    "word": "网络名誉权",
    "pinyin": "wǎng luò míng yù quán",
    "field": "通用",
    "difficulty": "低",
    "pack": "每日热词",
    "publishedDate": "2026-08-06",
    "category": "社会",
    "simpleExplanation": "你在网上的名声也受保护，别人不能随便在群里造谣、辱骂来败坏你的声誉。",
    "lifeAnalogy": "像你在小区业主群里的口碑，邻居不能凭空编排你、到处说你坏话还不担责，真造成损害要赔礼道歉加赔钱。",
    "practicalApplication": "被人在微信群、朋友圈诋毁时，可截图留证、起诉要求删除、道歉并赔偿；家长群、业主群发言也要守法律边界。",
    "commonMisconception": "以为“在群里说说又不犯法”——在班级群连续发布诋毁言论同样侵害名誉权，2026年8月6日上海一家长就因此被判赔偿。",
    "definition": "民事主体就自身名誉享有的不受非法贬损的社会评价利益，在网络空间同样受民法典保护；2026年8月6日上海浦东法院审理家长群名誉权纠纷案，一家长因在班级群连续发布诋毁同学言论被判赔偿，明确群聊言论法律边界。",
    "sourceUrl": "https://view.inews.qq.com/a/20260806A02A9Q00"
  },
  {
    "id": 2026080605,
    "word": "滞胀",
    "pinyin": "zhì zhàng",
    "field": "通用",
    "difficulty": "中",
    "pack": "每日热词",
    "publishedDate": "2026-08-06",
    "category": "财经",
    "simpleExplanation": "经济一边停滞不增长、一边物价还在涨，等于又没活干又啥都贵。",
    "lifeAnalogy": "像一个人生病没胃口（产出下滑），却还在发烧涨价（物价上升），吃药降息都难两全。",
    "practicalApplication": "看宏观新闻、做资产配置时会碰到：滞胀期现金和黄金往往更受青睐，股市估值易受压制，理解它能少踩坑。",
    "commonMisconception": "它不是单纯“通胀”或单纯“衰退”，而是两者同时出现；2026年8月6日美国就业数据弱、物价分项强，就被市场解读为典型滞胀信号。",
    "definition": "经济停滞（增长放缓、失业高）与通货膨胀（物价持续上涨）并存的困难局面；2026年8月6日宏观早评指出，美国7月私营部门新增就业远不及预期而物价分项飙升，形成“就业弱、价格强”的滞胀信号，推动贵金属显著走强。",
    "sourceUrl": "https://goodsfu.10jqka.com.cn/20260806/c678708260.shtml"
  },
  {
    "id": 2026080606,
    "word": "抱冬瓜降温",
    "pinyin": "bào dōng guā jiàng wēn",
    "field": "通用",
    "difficulty": "低",
    "pack": "每日热词",
    "publishedDate": "2026-08-06",
    "category": "科学",
    "simpleExplanation": "天太热时把大冬瓜当天然凉枕贴着睡，靠它肚里的水分慢慢吸热来降温。",
    "lifeAnalogy": "像抱着一个装了凉水的大水袋，水多又不容易马上变热，贴一会儿就帮你把身上的热气吸走一点。",
    "practicalApplication": "没空调或想省电时，可作短时间临时纳凉小妙招；但别整夜贴身抱，老人小孩和易过敏人群更要谨慎。",
    "commonMisconception": "它靠的是水的高比热容吸热，不是“冬瓜有神奇凉性”；整夜贴身怀抱易让瓜发酵变质“炸瓜”弄脏床单，还可能着凉。",
    "definition": "盛夏将冬瓜作为临时物理降温用品贴身纳凉的民间做法，原理是冬瓜含水量高、比热容大，能缓慢吸收体表热量；2026年8月6日“抱冬瓜睡觉降温”走红，随后出现“炸瓜”翻车，专家提醒仅宜短时间使用。",
    "sourceUrl": "https://so.html5.qq.com/page/real/search_news?docid=70000021_3476a73ad8320252"
  },
  {
    "id": 2026080607,
    "word": "苏超",
    "pinyin": "sū chāo",
    "field": "通用",
    "difficulty": "低",
    "pack": "每日热词",
    "publishedDate": "2026-08-06",
    "category": "文化",
    "simpleExplanation": "江苏13个城市各派一支球队打的业余足球联赛，火到全省都在看、连《求是》都点赞。",
    "lifeAnalogy": "像全省13个“兄弟城市”各组一支街坊队踢球，快递员、程序员都上场，谁赢谁输全城跟着嗨。",
    "practicalApplication": "文旅消费参考：比赛日带火餐饮夜市和景区，凭票根游城成潮流；普通市民花几十块就能现场感受家乡荣誉感。",
    "commonMisconception": "它不是职业中超，而是“一城一队”的群众体育IP；球员多为草根，票价亲民，火的核心是“普通人当主角+文旅联动”而非砸钱请球星。",
    "definition": "“江苏省城市足球联赛”的简称，2025年首届、2026年第二届爆火，由全省13个设区市组队、以“一城一主场”覆盖的群众足球赛事；2026年8月5日《求是》刊文点赞其为“人民的足球赛”，成为现象级文体旅IP。",
    "sourceUrl": "https://new.qq.com/rain/a/20260805A0CQFM00"
  },
  {
    "id": 2026080608,
    "word": "登革热",
    "pinyin": "dēng gé rè",
    "field": "通用",
    "difficulty": "中",
    "pack": "每日热词",
    "publishedDate": "2026-08-06",
    "category": "健康",
    "simpleExplanation": "一种被花蚊子叮了就会传染的热病，会突然高烧、浑身酸痛还起皮疹。",
    "lifeAnalogy": "像被带菌的“花蚊子”扎了一针，随后身体报警：发烧、头痛关节痛、皮肤发红，比普通感冒凶。",
    "practicalApplication": "去广东、东南亚等南方和境外地区旅行要穿长袖、涂驱蚊剂、清积水；回国后发烧出疹要主动告诉医生旅行史。",
    "commonMisconception": "它不会人传人，只通过伊蚊（花蚊子）叮咬传播；没有特效药，靠防蚊和及早就医，清理居家积水才是根本。",
    "definition": "由登革病毒引起、主要通过伊蚊（俗称花蚊子）叮咬传播的急性传染病，典型表现为突发高热、“三痛”与“三红”；2026年8月6日海南疾控提示八月蚊媒传染病进入高发，新冠阳性率亦上升，需重点防蚊。",
    "sourceUrl": "https://new.qq.com/rain/a/20260806A05QLP00"
  },
  {
    "id": 2026080609,
    "word": "共享充电宝",
    "pinyin": "gòng xiǎng chōng diàn bǎo",
    "field": "通用",
    "difficulty": "低",
    "pack": "每日热词",
    "publishedDate": "2026-08-06",
    "category": "生活",
    "simpleExplanation": "商场里扫码就能借的临时手机充电小电池，用完了在别处归还就行。",
    "lifeAnalogy": "像街边的“共享雨伞”，手机快没电时扫码借一个救急，逛完街在任意柜机还掉，按时间收费。",
    "practicalApplication": "出门在外手机电量告急时可应急续命；但要从正规柜机借、留意卫生与价格，别让劣质产品成“移动炸弹”。",
    "commonMisconception": "它不是绝对安全的小电器——流通环节多、质量参差，一旦电芯鼓包或短路无异于“移动炸弹”，2026年8月6日中青报报道正用大数据排查其隐患。",
    "definition": "通过柜机扫码租借、异地归还的便携式移动电源共享服务，解决外出手机续航焦虑；2026年8月6日中国青年报报道借助大数据模型监督排查共享充电宝安全隐患，因其流通性强，质量缺陷可能成为“移动炸弹”，呼吁加强监管。",
    "sourceUrl": "https://view.inews.qq.com/a/20260806A02A9100"
  },
  {
    "id": 2026080610,
    "word": "退役军人就业创业",
    "pinyin": "tuì yì jūn rén jiù yè chuàng yè",
    "field": "通用",
    "difficulty": "低",
    "pack": "每日热词",
    "publishedDate": "2026-08-06",
    "category": "其他",
    "simpleExplanation": "国家专门出的规矩，帮退伍军人学技能、好找工作、创业还能减税贷款。",
    "lifeAnalogy": "像一个“老兵再出发”保障包：免费培训、考公定向岗、开店有税收优惠和贴息贷款，扶上马再送一程。",
    "practicalApplication": "退役军人可按规定免费参加职业技能培训、报考面向退役军人的基层公务员岗、创业享税收与担保贷款；用人单位也据此落实优待。",
    "commonMisconception": "它不是普通优惠政策，而是2026年8月1日起施行的专门行政法规《退役军人就业创业促进条例》（国务院令840号），把长期好政策上升为全国性法定保障。",
    "definition": "指退役军人在教育培训、就业招录与创业扶持方面的保障工作；2026年8月1日起《退役军人就业创业促进条例》正式施行，共6章48条，明确免费技能培训、面向服役满5年高校退役军人的基层公务员定向岗及创业税收融资扶持，填补国家级专项立法空白。",
    "sourceUrl": "https://news.cctv.cn/2026/07/30/ARTI2tODk8OVqwrFaNoJdSdK260730.shtml"
  }
]