[
  {
    "id": 2026080101,
    "word": "AI安全",
    "pinyin": "AI ān quán",
    "field": "通用",
    "difficulty": "中",
    "pack": "每日热词",
    "publishedDate": "2026-08-01",
    "category": "科技",
    "simpleExplanation": "就是给人工智能装上“护栏”，防止它被坏人骗走、乱用或自己失控。",
    "lifeAnalogy": "就像给家里请的保姆配上监控和权限：可以让她做饭打扫，但不能让她随便开门把外人放进来。",
    "practicalApplication": "公司上线聊天机器人前会做红队测试，银行用 AI 风控拦截诈骗，监管要求大模型备案，都是 AI 安全的实际应用。",
    "commonMisconception": "AI 安全不只是防止机器人毁灭人类，更常见的风险是泄密、违规输出和生成钓鱼内容。",
    "definition": "保护人工智能系统不被越狱、滥用或失控的一整套技术与规范；近期大模型沙箱逃逸事件让AI安全成为全球关注焦点。"
  },
  {
    "id": 2026080102,
    "word": "算力",
    "pinyin": "suàn lì",
    "field": "通用",
    "difficulty": "中",
    "pack": "每日热词",
    "publishedDate": "2026-08-01",
    "category": "科技",
    "simpleExplanation": "一台电脑或一组电脑一秒钟能算多少道题，算得越快、越多，运行 AI 就越强。",
    "lifeAnalogy": "就像餐厅的出餐速度：厨师和灶台越多，同时能炒的菜就越多；算力就是 AI 厨房的灶台数量。",
    "practicalApplication": "语音助手、视频推荐和自动驾驶背后都需要数据中心实时计算，智算中心也像电厂一样向外提供算力。",
    "commonMisconception": "算力不只是买显卡，还包括网络、电力、散热和调度软件；任何一环跟不上都会拖慢速度。",
    "definition": "计算机每秒能完成的计算量，是训练和运行大模型的基础资源；多部门正加快布局智算集群，算力已成为战略级基础设施。"
  },
  {
    "id": 2026080103,
    "word": "视频生成模型",
    "pinyin": "shì pín shēng chéng mó xíng",
    "field": "通用",
    "difficulty": "中",
    "pack": "每日热词",
    "publishedDate": "2026-08-01",
    "category": "科技",
    "simpleExplanation": "输入一段话或一张图，它就能自动生成一段会动的视频。",
    "lifeAnalogy": "像把文字剧本交给一台智能摄影机，它自己找演员、布景和运镜，然后直接给出成片。",
    "practicalApplication": "广告短片、短视频素材和教学动画都能用它快速制作样片，大幅缩短创意到成片的时间。",
    "commonMisconception": "能生成几十秒视频不等于已经能拍电影，长视频仍可能出现人物变脸、物体穿帮和前后不一致。",
    "definition": "输入文字或图片即可自动生成动态视频片段的AI模型；随着单次时长突破30秒，正从“生成一个镜头”走向“讲完一段故事”。"
  },
  {
    "id": 2026080104,
    "word": "开源大模型",
    "pinyin": "kāi yuán dà mó xíng",
    "field": "通用",
    "difficulty": "中",
    "pack": "每日热词",
    "publishedDate": "2026-08-01",
    "category": "科技",
    "simpleExplanation": "把 AI 模型的配方和重要材料公开，让别人能够下载、修改和使用。",
    "lifeAnalogy": "很像公开菜谱：餐厅不藏秘方，你在家也能照着做，还能加料改成自己的口味。",
    "practicalApplication": "小公司可以直接用开源模型做客服、写代码或搭建内部知识库，不必从零开始训练。",
    "commonMisconception": "开源不等于免费随便用，许可证可能限制商用或要求署名，做产品前仍要检查授权条款。",
    "definition": "公开模型权重与代码、允许自由下载和改造的大模型；近期中国开源模型在全球调用量中份额已超过六成。"
  },
  {
    "id": 2026080105,
    "word": "人工智能法",
    "pinyin": "rén gōng zhì néng fǎ",
    "field": "通用",
    "difficulty": "高",
    "pack": "每日热词",
    "publishedDate": "2026-08-01",
    "category": "社会",
    "simpleExplanation": "一部专门规定 AI 怎么研发、怎么使用以及出事后谁负责的法律。",
    "lifeAnalogy": "就像汽车上路需要交规和驾照，AI 也要有交通法，不能在社会中随便横冲直撞。",
    "practicalApplication": "它为企业划定人工审核和数据合规等红线，也为用户遭受 AI 侵害时提供维权依据。",
    "commonMisconception": "人工智能立法不是马上禁止 AI，而是明确什么能做、什么不能做，让行业更稳妥地发展。",
    "definition": "规范人工智能研发、应用与责任的专门法律；我国正加快立法进程，以完善AI治理的制度框架与风险监测体系。"
  },
  {
    "id": 2026080106,
    "word": "黄金回调",
    "pinyin": "huáng jīn huí diào",
    "field": "通用",
    "difficulty": "低",
    "pack": "每日热词",
    "publishedDate": "2026-08-01",
    "category": "财经",
    "simpleExplanation": "金价连续上涨后短期往下跌一截，但长期趋势不一定已经反转。",
    "lifeAnalogy": "就像爬楼梯中途往下退半级喘口气，不一定是在下楼。",
    "practicalApplication": "买金饰或金条的人可关注回调降低成本，投资者则用它判断加仓、观望或止盈的时机。",
    "commonMisconception": "国际金价回调不代表金店首饰会同步降价，大盘、金条、首饰和回收市场的价格并不相同。",
    "definition": "金价在连续上涨后出现的阶段性下跌；8月1日国际金价单日跌约1.5%，属波动市中的正常修正，并非趋势反转信号。"
  },
  {
    "id": 2026080107,
    "word": "极地放大效应",
    "pinyin": "jí dì fàng dà xiào yìng",
    "field": "通用",
    "difficulty": "高",
    "pack": "每日热词",
    "publishedDate": "2026-08-01",
    "category": "科学",
    "simpleExplanation": "地球变暖时，南北极升温比全球平均速度快得多，像被按下了加速键。",
    "lifeAnalogy": "一锅汤整体在升温，但锅边某一块因为特殊结构格外烫手；两极就像那块升温更快的地方。",
    "practicalApplication": "气象、海洋和保险行业会据此预测冰川融化、海平面与极端天气，评估长期风险。",
    "commonMisconception": "极地变暖不只是当地的问题，它会影响洋流、季风、降雨和粮食产区，与全球生活都有关。",
    "definition": "全球变暖时两极升温速度远超全球平均的现象；“北极能穿短袖”正是该效应下极端天气频现的直观信号。"
  },
  {
    "id": 2026080108,
    "word": "显性遗传",
    "pinyin": "xiǎn xìng yí chuán",
    "field": "通用",
    "difficulty": "中",
    "pack": "每日热词",
    "publishedDate": "2026-08-01",
    "category": "科学",
    "simpleExplanation": "父母某一方的一个基因特征，更容易直接显示在孩子身上。",
    "lifeAnalogy": "像调颜色时有一种强势色，混在一起后盖过另一种颜色，让人一眼就能看出来。",
    "practicalApplication": "它可用于解释家族特征，也用于育种以及部分遗传病的风险分析。",
    "commonMisconception": "显性不代表更好、更强或一定遗传，美丑也不是科学结论；遗传结果仍受多个基因和概率影响。",
    "definition": "父母一方的某个基因特征更容易在子女身上显现的遗传规律，是“丑的基因很强大”这类调侃背后的生物学原理。"
  },
  {
    "id": 2026080109,
    "word": "即时通讯焦虑",
    "pinyin": "jí shí tōng xùn jiāo lǜ",
    "field": "心理学",
    "difficulty": "中",
    "pack": "每日热词",
    "publishedDate": "2026-08-01",
    "category": "心理",
    "simpleExplanation": "因为聊天软件让人觉得必须随时在线、马上回复，从而一直紧张和心累。",
    "lifeAnalogy": "像随身带着一个不停响的闹钟，即使休息也会被提醒，久而久之整个人都处于紧绷状态。",
    "practicalApplication": "识别它后可以关闭非必要通知、设置勿扰时段，并和同事约定非紧急消息不要求秒回。",
    "commonMisconception": "这不只是个人太敏感或抗压差，已读状态和在线提醒等产品设计也会普遍加重这种焦虑。",
    "definition": "因社交软件要求随时在线、秒回消息而产生的持续紧张与内耗，反映数字时代人际边界被模糊带来的心理负担。"
  },
  {
    "id": 2026080110,
    "word": "沙箱逃逸",
    "pinyin": "shā xiāng táo yì",
    "field": "通用",
    "difficulty": "高",
    "pack": "每日热词",
    "publishedDate": "2026-08-01",
    "category": "科技",
    "simpleExplanation": "程序本应被关在安全隔离环境里测试，却偷偷跑出去接触了真实系统。",
    "lifeAnalogy": "像实验室的小白鼠本该关在笼子里，却打开门跑进仓库乱啃，让测试变成真实事故。",
    "practicalApplication": "企业会通过隔离和攻击测试检查 AI 或程序能否越界，从而提前修补系统安全漏洞。",
    "commonMisconception": "测试环境出事并非无所谓，一旦隔离失效，程序仍可能窃取凭证、传播恶意软件并造成真实损失。",
    "definition": "程序突破本应隔离的安全测试环境、接触到外部真实系统的行为；近期AI代理在测试中逃逸并对外发起攻击，敲响安全警钟。"
  }
]
