[
  {
    "id": 2026080501,
    "word": "史翠珊效应",
    "pinyin": "shǐ cuì shān xiào yìng",
    "field": "心理学",
    "difficulty": "中",
    "pack": "每日热词",
    "publishedDate": "2026-08-05",
    "category": "社会",
    "simpleExplanation": "越是想偷偷删掉或捂住一条消息，反而会让更多人知道它，越捂越火。",
    "lifeAnalogy": "就像你故意把一张尴尬照片藏进抽屉，结果朋友们全跑来问“抽屉里是什么”，反而看得人更多。",
    "practicalApplication": "做公关、运营或遇到被人造谣时，先判断“删不删”——有些事越删越热闹，冷处理比硬压更有效。",
    "commonMisconception": "它名字像“史翠珊”发明的，其实是某明星打官司想下架照片反而让照片爆红后，人们给这种现象起的名，并非她创造的现象。",
    "definition": "指试图通过审查、删除或封锁信息来掩盖某事，结果反而引发更大关注和传播的反直觉现象；2026年8月5日“竹知了”玩梗风波中企业批量投诉下架反致破圈，被媒体称为典型史翠珊效应。",
    "sourceUrl": "https://view.inews.qq.com/a/20260805A057YP00"
  },
  {
    "id": 2026080502,
    "word": "盘古大模型",
    "pinyin": "pán gǔ dà mó xíng",
    "field": "通用",
    "difficulty": "中",
    "pack": "每日热词",
    "publishedDate": "2026-08-05",
    "category": "科技",
    "simpleExplanation": "一家公司把训练好的超级AI模型的“大脑图纸”免费公开，谁都能下载来用。",
    "lifeAnalogy": "像一个大厨把自己的招牌菜配方和做法免费公布在网上，别人照着也能开餐厅。",
    "practicalApplication": "开发者可把它接进自己的软件做问答、写代码；企业能本地部署保护数据；普通人也能在云平台免费体验。",
    "commonMisconception": "“开源”不等于“免费随便商用无限制”，通常要遵守开源协议，且模型能力仍受许可和使用条款约束。",
    "definition": "华为于2026年7月31日开源的openPangu-2.0-Pro大规模混合专家语言模型，总参数约5050亿、每次推理仅激活约180亿，权重与技术报告同步公开，知乎热榜持续讨论至8月5日。",
    "sourceUrl": "https://www.huawei.com/cn/news/2026/7/openpangu"
  },
  {
    "id": 2026080503,
    "word": "卫星互联网",
    "pinyin": "wèi xīng hù lián wǎng",
    "field": "通用",
    "difficulty": "中",
    "pack": "每日热词",
    "publishedDate": "2026-08-05",
    "category": "科技",
    "simpleExplanation": "把很多小卫星放到天上组成一张“太空Wi-Fi”，让地面任何角落都能连上网。",
    "lifeAnalogy": "像把信号塔搬到几万公里高的天上，再多的塔也覆盖不到的深山、沙漠、海上，卫星一眼就能罩住。",
    "practicalApplication": "给飞机、轮船、偏远山村提供网络；应急救灾时地面基站被毁也能通信；也是未来6G和全球覆盖的关键。",
    "commonMisconception": "它不是用一颗大卫星搞定，而是靠成百上千颗低轨小卫星组网，单颗失效不影响整体，靠数量织成网。",
    "definition": "由大量近地轨道小型卫星组成、向地面提供高速互联网接入的天基网络系统；2026年8月4日16时52分我国于海南商发用长征八号甲成功发射卫星互联网低轨23组卫星。",
    "sourceUrl": "https://news.cctv.cn/2026/08/04/ARTIl31Y3geKr1V36f4prtsX260804.shtml"
  },
  {
    "id": 2026080504,
    "word": "超强台风",
    "pinyin": "chāo qiáng tái fēng",
    "field": "通用",
    "difficulty": "中",
    "pack": "每日热词",
    "publishedDate": "2026-08-05",
    "category": "科学",
    "simpleExplanation": "台风里最厉害的一档，风力比普通台风还猛，破坏力极大。",
    "lifeAnalogy": "像台风里的“重量级拳王”，普通台风是小拳头，超强台风是全力一击，能把树连根拔起、房顶掀飞。",
    "practicalApplication": "看到气象台发布超强台风预警，沿海地区要停课停工、加固门窗、提前撤离；航运和农业也要据此避险。",
    "commonMisconception": "“超强台风”不是台风的名字，而是按中心风力划分的强度等级（近中心最大风速≥51米/秒），不同台风都可能达到。",
    "definition": "热带气旋按近中心最大风力划分的最高级别，中心附近最大风速达16级及以上（≥51米/秒）；2026年8月5日第13号台风“白海豚”一度增强为超强台风级并趋向我国华东沿海。",
    "sourceUrl": "https://new.qq.com/rain/a/20260805A07BTN00"
  },
  {
    "id": 2026080505,
    "word": "IPO",
    "pinyin": "IP O",
    "field": "通用",
    "difficulty": "中",
    "pack": "每日热词",
    "publishedDate": "2026-08-05",
    "category": "财经",
    "simpleExplanation": "一家公司第一次把自己拆成很多小份拿到股市上卖，让普通人也能当它的股东。",
    "lifeAnalogy": "像一个街头小吃摊做得太火，决定改造成连锁店并公开发行“入股券”，谁都能买一张成为小老板。",
    "practicalApplication": "投资者可在申购日打新碰运气；公司借此募资扩张；普通人通过IPO了解一家明星企业的真实家底和估值。",
    "commonMisconception": "“能IPO”不等于“买了就稳赚”，新股可能破发亏钱，而且上市前的信息披露和投资风险都要自己判断。",
    "definition": "首次公开募股（Initial Public Offering），指企业第一次公开发行股票并在证券交易所上市；2026年8月5日宇树科技启动初步询价，其人形机器人第一股IPO定于8月10日申购，引发热议。",
    "sourceUrl": "https://so.html5.qq.com/page/real/search_news?docid=70000021_5016a6b7cc914452"
  },
  {
    "id": 2026080506,
    "word": "环孢子虫病",
    "pinyin": "huán bāo zǐ chóng bìng",
    "field": "通用",
    "difficulty": "中",
    "pack": "每日热词",
    "publishedDate": "2026-08-05",
    "category": "健康",
    "simpleExplanation": "一种吃了被微小寄生虫污染的食物或水，导致反复拉肚子、胀气的肠道病。",
    "lifeAnalogy": "像看不见的小虫子偷偷住进你的肠子开派对，让你吃了药也总好不利索，一阵好一阵又犯。",
    "practicalApplication": "出国旅游、吃生鲜沙拉或喝生水后要留意；勤洗手、洗净果蔬能有效预防，腹泻久不愈要就医排查。",
    "commonMisconception": "它和普通的“吃坏肚子”不同，由一种叫环孢子虫的寄生虫引起，普通抗生素无效，需用专门药物，且易反复。",
    "definition": "由环孢子虫寄生引起的肠道传染病，经被污染的食物或水传播，典型症状是水样腹泻、腹胀、疲乏且易反复；2026年8月5日张朝阳在英语课分享美国环孢子虫病疫情，全美45州近7000例、2人死亡。",
    "sourceUrl": "https://view.inews.qq.com/a/20260805A057SN00"
  },
  {
    "id": 2026080507,
    "word": "自动驾驶强制国标",
    "pinyin": "zì dòng jià shǐ qiáng zhì guó biāo",
    "field": "通用",
    "difficulty": "高",
    "pack": "每日热词",
    "publishedDate": "2026-08-05",
    "category": "科技",
    "simpleExplanation": "国家给能自己开车的系统定下的“硬规矩”，达不到安全要求就不准上路。",
    "lifeAnalogy": "像给自动驾驶汽车发“驾照考试标准”，不光会跑，还得会刹车、会躲坑、出事能兜底，否则不许上路。",
    "practicalApplication": "买带L3/L4自动驾驶的新车时，可看它是否满足该强制国标；监管部门也据此准入和追责，保障乘客安全。",
    "commonMisconception": "“强制国标”是必须执行的底线标准，不是企业自愿参考；它主要管系统安全，不等于允许驾驶员全程脱手不管。",
    "definition": "工业和信息化部组织制定的《智能网联汽车 自动驾驶系统安全要求》（GB 44721—2026）强制性国家标准，适用于L3、L4级车辆，拟2027年7月1日实施，2026年8月5日相关解读广泛传播。",
    "sourceUrl": "https://www.jfdaily.com/sgh/detail?id=4032821"
  },
  {
    "id": 2026080508,
    "word": "主动投案",
    "pinyin": "zhǔ dòng tóu àn",
    "field": "通用",
    "difficulty": "低",
    "pack": "每日热词",
    "publishedDate": "2026-08-05",
    "category": "社会",
    "simpleExplanation": "犯了错的人在被抓之前，自己跑去跟组织交代问题、争取从宽处理。",
    "lifeAnalogy": "像考试作弊被风声吓到，主动找老师坦白“我错了”，比等老师查出来处分要轻一些。",
    "practicalApplication": "在反腐和违纪调查中，主动交代、退赃、配合调查能依法从轻或减轻；普通人也可用这个词理解新闻里的官员动向。",
    "commonMisconception": "“主动投案”不等于“马上没事”，它只是从宽情节，最终仍要查清问题并依纪依法处理，不等于免罪。",
    "definition": "涉嫌违纪违法人员在本组织或纪检监察机关尚未掌握、或虽掌握但尚未采取强制措施前，主动向组织交代问题的行为；2026年8月5日江门市委常委、纪委书记李志涉嫌严重违纪违法主动投案，接受审查调查。",
    "sourceUrl": "https://view.inews.qq.com/a/20260805A05Y7200"
  },
  {
    "id": 2026080509,
    "word": "清朗行动",
    "pinyin": "qīng lǎng xíng dòng",
    "field": "通用",
    "difficulty": "低",
    "pack": "每日热词",
    "publishedDate": "2026-08-05",
    "category": "社会",
    "simpleExplanation": "国家整治网上乱象、清掉谣言和低俗内容的系列专项行动，让网络环境更干净。",
    "lifeAnalogy": "像给小区做“大扫除”，把贴小广告的、吵架骂人的、造假骗人的统统清理掉，还大家一个清爽的公共空间。",
    "practicalApplication": "遇到网络谣言、网暴、不良信息，可在平台或网信部门举报；自媒体账号也据此规范言行，避免被禁言处罚。",
    "commonMisconception": "它不是一次性活动，而是长期持续的专项行动体系；整治的是违法不良信息，不等于限制正常发言和批评监督。",
    "definition": "由网信部门牵头、针对网络谣言、水军、低俗炒作等乱象开展的系列网络生态治理专项行动；2026年8月5日漯河通报三网民为博流量网上互撕被全平台禁言，系“清朗”行动典型案例。",
    "sourceUrl": "https://new.qq.com/rain/a/20260805A04OJI00"
  },
  {
    "id": 2026080510,
    "word": "高温热浪",
    "pinyin": "gāo wēn rè làng",
    "field": "通用",
    "difficulty": "低",
    "pack": "每日热词",
    "publishedDate": "2026-08-05",
    "category": "生活",
    "simpleExplanation": "一连好几天都热得不行、气温冲到35℃以上的天气，像被热气浪裹住一样。",
    "lifeAnalogy": "像把整个城市塞进一个没开空调的大烤箱，白天出门走几步就一身汗、透不过气。",
    "practicalApplication": "收到高温预警时，午后少出门、多喝水、别把小孩老人留在车里；户外作业要轮休防中暑。",
    "commonMisconception": "“高温预警”分蓝黄橙红等级，黄色（35℃）只是起步，真正危险的往往是持续多日的橙红预警，不能只看一天的温度。",
    "definition": "大范围、持续性异常高温天气过程，常伴气象部门高温预警；2026年8月5日江苏省变更发布高温黄色预警，南京、苏州等多地最高气温达35℃，需注意防暑降温。",
    "sourceUrl": "https://m.nmc.cn/publish/alarm/32000041600000_20260805094826.html"
  }
]
