[
  {
    "id": 2026081201,
    "word": "消费贷贴息",
    "pinyin": "xiāo fèi dài tiē xī",
    "field": "通用",
    "difficulty": "中",
    "pack": "每日热词",
    "publishedDate": "2026-08-12",
    "category": "财经",
    "simpleExplanation": "国家帮你付一部分利息——你用消费贷买家电、旅游、装修，政府按年贴息1%，相当于利息打了折。",
    "lifeAnalogy": "像商场“满减券”由国家代付：你刷卡消费，结账时系统自动扣掉国家补贴的那一块利息，你少掏钱。",
    "practicalApplication": "有装修、买车、育儿等大额消费的居民可关注办理银行的贴息；理财时理解“财政撬动消费”的宏观经济逻辑。",
    "commonMisconception": "贴息不等于“借钱不要钱”——仍需还本付息，且只对真实消费部分补贴，套现、信用卡违规用途不享受。",
    "definition": "由财政部、央行、金融监管总局推出的个人消费贷款财政贴息政策：对符合条件的消费贷按年1个百分点贴息、中央财政承担九成，2026年8月仍在执行期内，旨在降低居民信贷成本、提振消费。",
    "sourceUrl": "https://finance.people.com.cn/n1/2025/0813/c1004-40541073.html"
  },
  {
    "id": 2026081202,
    "word": "增程车加92",
    "pinyin": "zēng chéng chē jiā jiǔ èr",
    "field": "通用",
    "difficulty": "低",
    "pack": "每日热词",
    "publishedDate": "2026-08-12",
    "category": "科技",
    "simpleExplanation": "新出的增程车（像小米昆仑、小鹏G9L）现在说加便宜的92号汽油也行，车主每年能省不少油钱。",
    "lifeAnalogy": "像本来只喝矿泉水的豪华电水壶，现在告诉你自来水烧开也能用，出门不用满世界找“贵水”了。",
    "practicalApplication": "打算买增程SUV的人可放宽油品顾虑、降低长途补能焦虑；看车时把“是否挑油品”列进对比清单。",
    "commonMisconception": "能加92不是“黑科技突破”，而是增程器不直接驱动车轮、且调低压缩比换来的取舍，不代表所有车都该降标号。",
    "definition": "指新款增程车型（如小米昆仑、小鹏G9L）纷纷宣布兼容92号汽油的现象；2026年8月12日“现在的增程车突然能加92了”登上热搜，反映车企从死磕热效率转向降低用户养车成本。",
    "sourceUrl": "https://finance.sina.cn/tech/2026-08-12/detail-inimzqcp6893033.d.html?vt=4"
  },
  {
    "id": 2026081203,
    "word": "台风扎堆",
    "pinyin": "tái fēng zhā duī",
    "field": "通用",
    "difficulty": "中",
    "pack": "每日热词",
    "publishedDate": "2026-08-12",
    "category": "科学",
    "simpleExplanation": "今年夏天台风一个接一个、还经常好几个同时来，8月12日又生成了新台风“浪卡”，大家都很关注。",
    "lifeAnalogy": "像考试月错题集中爆发：平时一个月一道，今年一周连着来三四道，还经常“组团”出现，防不胜防。",
    "practicalApplication": "东南沿海居民学会看预警信号（黄橙红）、提前囤水囤粮、远离海边山区；出行前查台风路径再订票。",
    "commonMisconception": "台风“略强于”某个历史台风，不代表破坏力翻倍；真正致灾的多是暴雨、风暴潮和地形叠加，不只看中心风力。",
    "definition": "指2026年盛夏西北太平洋台风连续密集生成、频繁登陆我国的现象；至8月11日已生成16个台风、4个登陆，新台风“浪卡”8月12日生成，专家归因于强厄尔尼诺背景下的海温异常偏暖。",
    "sourceUrl": "https://www.toutiao.com/w/1873300497115208/"
  },
  {
    "id": 2026081204,
    "word": "宇树科技IPO",
    "pinyin": "yǔ shù kē jì",
    "field": "通用",
    "difficulty": "中",
    "pack": "每日热词",
    "publishedDate": "2026-08-12",
    "category": "财经",
    "simpleExplanation": "做机器人的宇树科技上市了，叫“人形机器人第一股”，8月10日打新、12日缴款，中签率创下科创板最难。",
    "lifeAnalogy": "像班里最会跳舞的机器人团队去参加“全校最能赚钱公司”选拔，大家都抢着买它的入场券，票却少得可怜。",
    "practicalApplication": "关注硬科技与机器人赛道的投资者可研究其招股书；普通人借此理解“具身智能”从概念走向财报的资本节点。",
    "commonMisconception": "发行价不等于上市首日价，更不代表订单已兑现；中签不等于稳赚，机器人行业仍处早期、价格波动大。",
    "definition": "做人形机器人的宇树科技（688836）登陆科创板，被称为“人形机器人第一股”；2026年8月10日申购、11日公布中签号、12日缴款，发行价150.8元，创科创板最难中签纪录。",
    "sourceUrl": "https://new.qq.com/rain/a/20260812A054NB00?refer=cp_1009"
  },
  {
    "id": 2026081205,
    "word": "英伟达开源模型",
    "pinyin": "yīng wěi dá kāi yuán mó xíng",
    "field": "通用",
    "difficulty": "中",
    "pack": "每日热词",
    "publishedDate": "2026-08-12",
    "category": "科技",
    "simpleExplanation": "芯片巨头英伟达也发免费开源大模型了，叫Nemotron 3.5 Lightning，普通电脑单卡就能跑，专门帮AI智能体干活。",
    "lifeAnalogy": "像卖跑步机的公司顺便送你一本“怎么在家练”的免费教程，你练得越多，以后越可能买它的跑步机。",
    "practicalApplication": "开发者可在本地用Ollama、LM Studio部署它做专属助手；理解“开源模型利好芯片销售”的商业逻辑。",
    "commonMisconception": "开源不等于“随便商用无限制”——须看其开放权重许可证；它也不是取代大推理模型，而是专做高频执行。",
    "definition": "英伟达于2026年8月11日发布Nemotron 3.5 Lightning，是其首款开源（开放权重）大模型；300亿参数MoE、单卡可跑，专为智能体高频执行任务设计，彰显“免费AI利好芯片销售”的策略。",
    "sourceUrl": "https://blogs.nvidia.cn/blog/local-ai-open-source-models-agents-nemotron/"
  },
  {
    "id": 2026081206,
    "word": "胶球",
    "pinyin": "jiāo qiú",
    "field": "物理",
    "difficulty": "高",
    "pack": "每日热词",
    "publishedDate": "2026-08-12",
    "category": "科学",
    "simpleExplanation": "科学家找到了一种“纯由力构成”的粒子——胶球，它由传递强相互作用的胶子自己绑在一起，找了近50年。",
    "lifeAnalogy": "像你一直听说“胶水能自己粘成一团东西”，但半世纪没人真正见过，直到我国实验把证据链补全才确认。",
    "practicalApplication": "帮助理解粒子物理与“标准模型”的验证；科普时能讲清“力也能变成物质”这一反直觉概念。",
    "commonMisconception": "胶球不是马上能用的黑科技——它是基础物理验证，离消费级应用极远，别把“发现”写成“技术落地”。",
    "definition": "由纯胶子构成的粒子，是量子色动力学预言、却困扰学界近半世纪的物质形态；2026年8月，北京谱仪Ⅲ（BESⅢ）用15年建立完整证据链，证实X(2370)主要成分正是胶球。",
    "sourceUrl": "https://www.cas.cn/cm/202608/t20260807_5117989.shtml"
  },
  {
    "id": 2026081207,
    "word": "医疗垃圾手机壳",
    "pinyin": "yī liáo lā jī shǒu jī ké",
    "field": "通用",
    "difficulty": "中",
    "pack": "每日热词",
    "publishedDate": "2026-08-12",
    "category": "健康",
    "simpleExplanation": "新闻曝光部分便宜手机壳可能是用废弃针管、输液管等医疗垃圾做的，苯和重金属超标，随身带着像揣“毒源”。",
    "lifeAnalogy": "像你每天抱着的毛绒玩具，其实是医院扔掉的针头简单洗洗碎碎做成的，闻着还有刺鼻味，想想就后怕。",
    "practicalApplication": "买手机壳认准品牌、厂名厂址和检测报告，别贪9.9元三无壳；发现异味刺鼻及时停用。",
    "commonMisconception": "不是所有手机壳都有毒——正规品牌原料合规；“医疗垃圾做的”特指无标识、无质检的超低价“三无”产品。",
    "definition": "指部分廉价“食品级”软壳疑似用废弃针管、输液管等医疗垃圾加工而成；2026年8月9日相关话题登微博热搜，被曝苯、塑化剂、重金属超标，10元以下手机壳合格率不足5%。",
    "sourceUrl": "https://cbgc.scol.com.cn/news/7835968"
  },
  {
    "id": 2026081208,
    "word": "胖东来现象",
    "pinyin": "pàng dōng lái xiàn xiàng",
    "field": "通用",
    "difficulty": "低",
    "pack": "每日热词",
    "publishedDate": "2026-08-12",
    "category": "社会",
    "simpleExplanation": "胖东来老板因房东乱涨租，宁愿关掉一年赚1亿的老店、自己掏65亿建商场，引发“公平比利润重要”的讨论。",
    "lifeAnalogy": "像你租的店面被房东坐地起价，你干脆不租了、拿出积蓄自己盖栋楼，只为不用再看人脸色做生意。",
    "practicalApplication": "创业者和商家可思考“掌握核心资产、不被租金卡脖子”的长期策略；消费者理解“价值观也是竞争力”。",
    "commonMisconception": "这不是“有钱任性”——它用自有现金流、不贷款重资产布局，是对不公平契约的主动切割，并非盲目扩张。",
    "definition": "指胖东来创始人于东来因房东暴力涨租，宁关年赚1亿的老店、自掏65亿自建商场引发的商业价值观讨论；2026年8月刷屏，被视为“公平优先于利润”的零售样本。",
    "sourceUrl": "https://finance.sina.com.cn/jjxw/2026-08-11/doc-inimxvun5850065.shtml"
  },
  {
    "id": 2026081209,
    "word": "星巴克占座",
    "pinyin": "xīng bā kè zhàn zuò",
    "field": "通用",
    "difficulty": "低",
    "pack": "每日热词",
    "publishedDate": "2026-08-12",
    "category": "社会",
    "simpleExplanation": "星巴克里“只坐不买”占座的人太多，花钱买咖啡的顾客反而没座位，8月12日“该管管”冲上热搜引争议。",
    "lifeAnalogy": "像你花钱进了自习室，却发现一堆没交钱的人占着桌子睡觉、外放音乐，你反而只能站着，当然不爽。",
    "practicalApplication": "去咖啡店办公可错峰；商家理解“第三空间”溢价靠秩序支撑；遇到占座可礼貌反馈店员协商。",
    "commonMisconception": "星巴克从未强制消费入座，它卖的是空间体验而非“门票”；争议的不是该不该赶人，而是如何平衡开放与公平。",
    "definition": "指星巴克门店“只坐不买”占座乱象引发的争议；2026年8月12日“星巴克该管管只坐不买的人”登热搜，舆论从呼吁包容转向要求“消费入座”，折射咖啡价格战下的空间公平重定价。",
    "sourceUrl": "https://finance.sina.cn/tech/2026-08-12/detail-inimzivx4142408.d.html?vt=4"
  },
  {
    "id": 2026081210,
    "word": "金价走强",
    "pinyin": "jīn jià zǒu qiáng",
    "field": "通用",
    "difficulty": "中",
    "pack": "每日热词",
    "publishedDate": "2026-08-12",
    "category": "财经",
    "simpleExplanation": "最近黄金又大涨，国内基础金价到955元一克，金饰品一个月涨了超100元，买金饰和炒金的人都紧张起来。",
    "lifeAnalogy": "像超市里平时10块一包的盐突然涨到20，大家都琢磨要不要囤点，又怕买在最高点。",
    "practicalApplication": "有结婚、送礼刚需可关注分批买入；投资者理解金价与美元、利率、避险情绪的关联，别盲目追高。",
    "commonMisconception": "金价上涨不等于“闭眼买就赚”——它受美联储利率与汇率影响波动大，金饰还含高额工费，变现未必划算。",
    "definition": "指2026年8月国际金价强势反弹、国内金价与金饰价格同步大涨；至8月12日国内基础金价升至955元/克，品牌金饰克价一个月飙涨超100元，一度逼近1330元。",
    "sourceUrl": "https://www.163.com/dy/article/L45B34F805199UVN.html"
  }
]