[
  {
    "id": 2026080301,
    "word": "地震预警",
    "pinyin": "dì zhèn yù jǐng",
    "field": "通用",
    "difficulty": "低",
    "pack": "每日热词",
    "publishedDate": "2026-08-03",
    "category": "科学",
    "simpleExplanation": "地震还没到你这儿，系统就提前几秒到几十秒发消息警告你，让你有时间躲一下。",
    "lifeAnalogy": "像楼上的水管要爆了，物业先在群里喊一声“快躲开”，你听到就能先退到安全地方。",
    "practicalApplication": "手机开通地震预警后，深夜睡觉也能被响铃叫醒；微信8月2日新上的“震感汇聚”还能让你一键上报“我这边晃不晃”，帮大家互相确认安全。",
    "commonMisconception": "预警不是“预测”哪天会震，而是地震已经发生后、波还没传到你这里时用速度差抢出几秒到几十秒，无法提前几天预报。",
    "definition": "利用地震波传播比电磁波慢的原理，在破坏性横波到达前数秒至数十秒发出警报的系统；8月3日2时21分四川宜宾高县发生4.8级地震，微信地震预警新功能刚于8月2日上线。",
    "sourceUrl": "https://new.qq.com/rain/a/20260803A01PI300"
  },
  {
    "id": 2026080302,
    "word": "AI机器人流量",
    "pinyin": "AI jī qì rén liú liàng",
    "field": "通用",
    "difficulty": "中",
    "pack": "每日热词",
    "publishedDate": "2026-08-03",
    "category": "科技",
    "simpleExplanation": "上网的“人”里，有越来越多其实是自动运行的AI程序（机器人），不是真人。",
    "lifeAnalogy": "像一家餐厅里本来坐满食客，忽然有一半座位换成了不会吃饭、只会不停点单的机器人，后厨还得分不清谁真饿。",
    "practicalApplication": "做网站的人要识别并限制AI爬虫，防止内容被白嫖、服务器被刷爆；普通人也能理解为什么网上“评论区”越来越像机器在说话。",
    "commonMisconception": "AI流量不是“用户变多了”的好事，它不买东西、不互动，反而挤占带宽、稀释真实数据，对网站运营多是负担。",
    "definition": "由爬虫、AI代理等自动化程序产生的网络访问量；据《财富》汇总，2025年AI流量增速为人类8倍、同比暴涨7851%，2026年6月全球近六成流量由AI生成。",
    "sourceUrl": "https://weibo.com/2099539611/5327744613484762"
  },
  {
    "id": 2026080303,
    "word": "霍尔木兹海峡",
    "pinyin": "huò ěr mù zī hǎi xiá",
    "field": "通用",
    "difficulty": "中",
    "pack": "每日热词",
    "publishedDate": "2026-08-03",
    "category": "财经",
    "simpleExplanation": "波斯湾通往大洋的唯一海上窄口，全世界很大一部分石油都要从这儿过，它一有事油价就跳。",
    "lifeAnalogy": "像小区唯一的车库大门，门口堵车或吵架，里面所有车都出不去，加油站立马涨价。",
    "practicalApplication": "关注它能在油价暴涨前预判加油、物流和运输成本变化；8月3日多方称特朗普取消对伊朗军事打击、海峡有望开放，国际油价暗盘一度闪崩超6%。",
    "commonMisconception": "它只是“一个海峡”不是产油国，但它卡着约五分之一的全球海运石油咽喉，地缘一紧张，油价反应比产量本身还快。",
    "definition": "连接波斯湾与阿曼湾的狭窄航道，是全球海运石油主要咽喉；2026年8月3日因相关局势缓和、海峡有望开放，国际油价暗盘闪崩逾6%。",
    "sourceUrl": "https://www.163.com/dy/article/L3COUHJ30524VF0A.html"
  },
  {
    "id": 2026080304,
    "word": "多模态大模型",
    "pinyin": "duō mó tài dà mó xíng",
    "field": "通用",
    "difficulty": "中",
    "pack": "每日热词",
    "publishedDate": "2026-08-03",
    "category": "科技",
    "simpleExplanation": "一种能同时看懂文字、图片、声音等多种信息的AI模型，不像老模型只会处理一种。",
    "lifeAnalogy": "像一个人既会读书、又会看画、还能听你说话，而不是只会做单一科目的“偏科生”。",
    "practicalApplication": "用它做图文笔记、视频字幕、看图问答都很方便；8月3日MiniMax开源H3，国产GPU（沐曦、海光、摩尔、壁仞）首日就完成适配，本地跑多模态更方便了。",
    "commonMisconception": "“多模态”不等于“更聪明”，它强在输入形式多样，但回答质量仍取决于训练数据和规模，别把它当万能。",
    "definition": "能统一处理文本、图像、音频等多种类型输入的生成式AI模型；2026年8月3日MiniMax开源H3多模态模型，多家国产GPU厂商实现首日适配。",
    "sourceUrl": "https://www.163.com/dy/article/L3DIPUCF0550WHYR.html"
  },
  {
    "id": 2026080305,
    "word": "自主智能体",
    "pinyin": "zì zhǔ zhì néng tǐ",
    "field": "通用",
    "difficulty": "高",
    "pack": "每日热词",
    "publishedDate": "2026-08-03",
    "category": "科技",
    "simpleExplanation": "一种会自己定计划、自己动手干活、干完还能自己检查的AI“小员工”，不用你一步步盯着。",
    "lifeAnalogy": "像你雇了个实习生，你只说“做个网站”，他就会自己查资料、写代码、测试、改错，最后交成品。",
    "practicalApplication": "8月3日阿里发布Qwen3.8，能从空文件夹自主完成十几天真实项目、交付可用的智能体框架，未来可帮人自动跑调研、写报告、搭原型。",
    "commonMisconception": "它还不是完全“自我管理”的真人，长任务里仍可能跑偏或卡死，关键结果需要人复核，不能闭眼全交给它。",
    "definition": "能自主规划、调用工具并执行多步任务以达成目标的AI系统；2026年8月3日阿里Qwen3.8实现从空文件夹自主交付项目，展示了Agentic能力。",
    "sourceUrl": "https://so.html5.qq.com/page/real/search_news?docid=70000021_5186a7015f131352"
  },
  {
    "id": 2026080306,
    "word": "脑卒中",
    "pinyin": "nǎo cù zhòng",
    "field": "通用",
    "difficulty": "中",
    "pack": "每日热词",
    "publishedDate": "2026-08-03",
    "category": "健康",
    "simpleExplanation": "脑血管突然堵住或破裂，脑子缺血缺氧，身体一边使不上劲、说话含糊，就是“中风”。",
    "lifeAnalogy": "像水管突然被堵或爆裂，下游的田地瞬间断水，对应的那片“身体田地”马上罢工。",
    "practicalApplication": "天热时更要防，8月2日杭州一位老人因怕冷不开空调突发脑梗；牢记“脸歪、手垂、说话不清”快打120，别像他老伴那样步行送医耽误抢救。",
    "commonMisconception": "它不是“老年专属”，年轻人熬夜、高血压也会中招；发作后必须原地休息立刻拨120，乱搬动反而更危险。",
    "definition": "因脑血管阻塞或破裂导致脑组织损伤的急性病，俗称中风；2026年8月杭州一老人高温天不开空调突发脑梗，提示夏季也要警惕脑血管意外。",
    "sourceUrl": "https://view.inews.qq.com/a/20260802V09TKF00"
  },
  {
    "id": 2026080307,
    "word": "数字鸿沟",
    "pinyin": "shù zì hóng gōu",
    "field": "心理学",
    "difficulty": "中",
    "pack": "每日热词",
    "publishedDate": "2026-08-03",
    "category": "社会",
    "simpleExplanation": "不同人群在会用、用得起数字工具上的差距，像一条沟，一边很溜一边被挡在外。",
    "lifeAnalogy": "像同班同学，有人从小有家教补电脑课，有人连智能手机都不会用，考试自然差出一截。",
    "practicalApplication": "8月2日“父母叫豆包我已经应激了”上热搜，正因长辈和年轻人AI使用习惯差太大；理解它能帮我们更有耐心地教父母用手机、用AI。",
    "commonMisconception": "它不只是“会不会用手机”，更包括获取信息、辨别真假、被算法影响程度的差距，老少之间、城乡之间都存在。",
    "definition": "不同群体在接入和使用数字技术上的差距；2026年8月“父母过度依赖豆包AI干涉生活”引热议，凸显代际间的AI使用数字鸿沟。",
    "sourceUrl": "http://view.inews.qq.com/a/20260802A09W6B00"
  },
  {
    "id": 2026080308,
    "word": "邮件礼仪",
    "pinyin": "yóu jiàn lǐ yí",
    "field": "通用",
    "difficulty": "低",
    "pack": "每日热词",
    "publishedDate": "2026-08-03",
    "category": "教育",
    "simpleExplanation": "写工作邮件时的一套规矩，比如有称呼、说清来意、结尾致谢，让人看了舒服又高效。",
    "lifeAnalogy": "像进门先敲门、说话先问好，同样是办事，有礼貌别人更愿意帮你。",
    "practicalApplication": "8月2日“大学生不懂邮件礼仪”登热搜，建议纳入必修课；求职、实习、对接客户时一封规范的邮件能直接拉好感、少误会。",
    "commonMisconception": "它不等于“越长越客气”，啰嗦反而添乱；重点是要素齐全、目的清晰、称呼准确，而不是堆客套话。",
    "definition": "撰写电子邮件时约定俗成的礼貌与规范；2026年8月“大学生不懂邮件礼仪”引发热议，反映即时通讯时代正式电邮能力弱化。",
    "sourceUrl": "http://view.inews.qq.com/a/20260802A0AF7H00"
  },
  {
    "id": 2026080309,
    "word": "公积金",
    "pinyin": "gōng jī jīn",
    "field": "通用",
    "difficulty": "低",
    "pack": "每日热词",
    "publishedDate": "2026-08-03",
    "category": "财经",
    "simpleExplanation": "单位和你每月各存一笔钱进专属账户，专门用来租房、买房、装修等住房开销，自己也能用。",
    "lifeAnalogy": "像公司和你合伙往一个“买房储蓄罐”里投币，平时不能乱花，关键时刻能派上大用场。",
    "practicalApplication": "8月3日“公积金新变化”冲上热搜第一：条例拟放宽提取、把装修和物业费也纳入，外卖员等灵活就业者也能自愿缴存，省钱机会变多。",
    "commonMisconception": "它不是“工资之外的白送钱”，本质是你自己的钱（加单位配比），离职或换城要注意转移接续，别以为取不出就浪费了。",
    "definition": "单位和职工共同缴存的长期住房储蓄，专用于住房消费；2026年8月国务院拟修订条例，放宽提取范围、扩大覆盖至灵活就业人群，冲上热搜。",
    "sourceUrl": "https://news.cctv.cn/2026/08/02/ARTIcuPyJtEjrr5rs0jE24aO260802.shtml"
  },
  {
    "id": 2026080310,
    "word": "台风预警",
    "pinyin": "tái fēng yù jǐng",
    "field": "通用",
    "difficulty": "低",
    "pack": "每日热词",
    "publishedDate": "2026-08-03",
    "category": "科学",
    "simpleExplanation": "气象部门预报台风要来、可能有多大风雨，提前发信号提醒大家防备。",
    "lifeAnalogy": "像学校广播“暴风雨要来了，请关窗待在教室”，提前一步比临时抱佛脚安全得多。",
    "practicalApplication": "8月3日超强台风“白海豚”预计8日起影响华东，浙江、江西需防暴雨；看到预警就提前囤水粮、收阳台、取消海边行程最稳妥。",
    "commonMisconception": "预警分蓝黄橙红等级，不是“有预警就一定要停课停工”，要看本地发布的响应级别和具体指示再行动。",
    "definition": "气象部门对台风路径与风雨影响的提前预报和分级警示；2026年8月3日超强台风“白海豚”预计8日前后影响华东，多地部署防御。",
    "sourceUrl": "https://www.163.com/dy/article/L3DIB8BF0519DDQ2.html"
  }
]