[
  {
    "id": 2026080701,
    "word": "大模型涨价",
    "pinyin": "dà mó xíng zhǎng jià",
    "field": "通用",
    "difficulty": "中",
    "pack": "每日热词",
    "publishedDate": "2026-08-07",
    "category": "科技",
    "simpleExplanation": "一些国产AI大模型开始不再免费或低价，用它们写文案、查资料要按量收费了。",
    "lifeAnalogy": "像以前免费试喝的奶茶突然改成按杯卖，你用得越多付得越多，但续杯也更便宜稳定了。",
    "practicalApplication": "开发者和企业用API接入AI时要算清成本、关注峰谷定价；普通人理解“AI服务不是永远免费”，选模型看性价比。",
    "commonMisconception": "涨价不等于“闭源收费”——国产大模型多坚持开源，收费主要针对大规模调用，小用量和个人体验仍便宜甚至免费。",
    "definition": "国内大模型从免费开源走向商业化定价的趋势；2026年8月DeepSeek宣布API大幅涨价、阿里计划对下一代Qwen大模型大规模用户收费，国产模型集体步入Token计价阶段。",
    "sourceUrl": "https://www.nbd.com.cn/articles/2026-08-07/4534918.html"
  },
  {
    "id": 2026080702,
    "word": "递归自改进AI",
    "pinyin": "dì guī zì gǎi jìn AI",
    "field": "通用",
    "difficulty": "高",
    "pack": "每日热词",
    "publishedDate": "2026-08-07",
    "category": "科技",
    "simpleExplanation": "一种能自己想办法让自己变得更聪明的AI，像不断给自己升级打补丁的机器人。",
    "lifeAnalogy": "像一个会自己改作业、发现错处就重写答案的学生，越练越强，不用老师每次手把手教。",
    "practicalApplication": "投资与从业者关注其算力消耗与安全边界；理解它能帮你判断“AI会不会失控”这类讨论，区分科幻与现实进展。",
    "commonMisconception": "它现在还远不能“自己觉醒统治世界”——目前只是用算力反复迭代模型，效果会递减且评估标准缺失，仍是受控实验。",
    "definition": "能通过学习自身输出来持续优化、迭代自身能力的AI系统；2026年8月多家AI实验室签下数亿美元算力合同研发递归自改进AI，把算力从成本变成战略资产。",
    "sourceUrl": "https://www.tmtpost.com/8094750.html"
  },
  {
    "id": 2026080703,
    "word": "L3智能体",
    "pinyin": "L3 zhì néng tǐ",
    "field": "通用",
    "difficulty": "中",
    "pack": "每日热词",
    "publishedDate": "2026-08-07",
    "category": "科技",
    "simpleExplanation": "AI不再只会聊天，而能自己动手办事的“高级助手”阶段，叫L3智能体。",
    "lifeAnalogy": "像从“只会回答问题的客服”升级成“能真的帮你下单、订票、跑流程的私人助理”。",
    "practicalApplication": "企业用它自动处理报销、客服、数据分析；普通人可用智能体规划行程、写报告，理解“AI能行动”与“只能聊天”的区别。",
    "commonMisconception": "L3不是终点也不是“通用人工智能”——它源自OpenAI的AGI五级路线图，其上还有创新者L4、组织者L5，离真正自主仍有距离。",
    "definition": "按AGI能力路线图划分的第三级AI，不仅能推理思考、还能自主采取行动完成任务；2026年8月业内称行业已进入L3时代，中美前沿模型性能差距实质性收窄。",
    "sourceUrl": "https://www.nbd.com.cn/articles/2026-08-06/4534527.html"
  },
  {
    "id": 2026080704,
    "word": "China Cool",
    "pinyin": "China Cool",
    "field": "通用",
    "difficulty": "低",
    "pack": "每日热词",
    "publishedDate": "2026-08-07",
    "category": "文化",
    "simpleExplanation": "外国游客发现中国又凉快又高科技、好玩好逛，把这份夏日体验叫“China Cool”。",
    "lifeAnalogy": "像邻居来你家避暑，发现你家装了空调、还能泡温泉打麻将、跟机器人击掌，回去直夸“你家真酷”。",
    "practicalApplication": "文旅与入境游参考：避暑加科技体验成新卖点；普通人可理解“软实力”如何靠真实体验传播，不必硬喊口号。",
    "commonMisconception": "它不只是“凉快”——核心是全域空调自由、丰富避暑胜地和未来感“科技游”共同构成的综合体验，是消费与形象的双向吸引。",
    "definition": "外国游客在中国“清凉又酷”的避暑科技游体验在海内外走红的说法；2026年8月盛夏，吹空调吃火锅、与机器人互动等短视频在海外社交平台广为传播。",
    "sourceUrl": "https://www.163.com/dy/article/L3N5PVPK0531TTYW.html"
  },
  {
    "id": 2026080705,
    "word": "追星理性消费",
    "pinyin": "zhuī xīng lǐ xìng xiāo fèi",
    "field": "心理学",
    "difficulty": "低",
    "pack": "每日热词",
    "publishedDate": "2026-08-07",
    "category": "心理",
    "simpleExplanation": "粉丝们提醒彼此：喜欢明星可以，但别为了追星花钱太多、把自己搞得很累很不开心。",
    "lifeAnalogy": "像逛街看到喜欢的东西会买，但钱包和心情要先顾好，不能为了跟风把午饭钱都搭进去。",
    "practicalApplication": "追星族设消费上限、及时止损；家长和孩子聊“理性喜欢”；识别粉圈话术与情绪绑架，保护自己的财务和心理健康。",
    "commonMisconception": "理性追星不是“不能花钱、不能喜欢”，而是把“自己开不开心”放第一位，当热爱变成内耗就该重新划清边界。",
    "definition": "粉丝群体兴起的“先爱自己、再追偶像”共识，强调追星以自我感受为先、拒绝氪金绑架与情绪内耗；2026年8月7日“追星要先照顾好自己”登上微博热议。",
    "sourceUrl": "https://ent.sina.cn/2026-08-07/detail-inimmpqr4287280.d.html"
  },
  {
    "id": 2026080706,
    "word": "竹知了",
    "pinyin": "zhú zhī liǎo",
    "field": "通用",
    "difficulty": "中",
    "pack": "每日热词",
    "publishedDate": "2026-08-07",
    "category": "社会",
    "simpleExplanation": "一种几块钱的童年玩具，因为声音像某车企发布会名场面被网友玩梗，闹出下架风波。",
    "lifeAnalogy": "像你学着明星说话逗乐大家，结果对方较真说你“丑化”TA，反而让更多人来围观起哄。",
    "practicalApplication": "网友二创时留意言论边界与企业名誉权；企业维权需把握分寸；普通人看懂“玩梗”与“侵权”的法律界限在哪里。",
    "commonMisconception": "名誉权侵权不要求“直接点名”——只要用特定元素组合能让公众认出指向谁，就可能构成侵权，玩梗也可能越界。",
    "definition": "会发出蝉鸣声的传统竹制玩具；2026年8月初其摇动声与某车企发布会名场面被拼接玩梗走红，企业投诉下架引发“言论边界与商誉保护”的公共讨论。",
    "sourceUrl": "https://so.html5.qq.com/page/real/search_news?docid=70000021_6406a706e8b56152"
  },
  {
    "id": 2026080707,
    "word": "运营商新规",
    "pinyin": "yùn yíng shāng xīn guī",
    "field": "通用",
    "difficulty": "低",
    "pack": "每日热词",
    "publishedDate": "2026-08-07",
    "category": "社会",
    "simpleExplanation": "移动、电信、联通三家宣布，网上第三方店铺不能再卖手机卡，办卡要去官方App。",
    "lifeAnalogy": "像小区门口代售水票的黄牛被取消资格，以后买水票只能去自来水公司正规窗口，防被骗也防信息泄露。",
    "practicalApplication": "办手机卡认准官方App和官网，别信“19元200G”低价陷阱；已买的卡可正常用，但优惠可能随店铺关闭而消失。",
    "commonMisconception": "这不是“卡不能用了”——已激活的第三方渠道卡照常使用，新规只禁“新办”，目的是整治虚假宣传和信息泄露乱象。",
    "definition": "三大运营商规范互联网渠道售卡的管理措施；2026年8月1日起第三方互联网渠道停办号卡，“19元200G”等低价流量卡集体退场，意在反内卷与保护用户信息安全。",
    "sourceUrl": "https://www.thepaper.cn/newsDetail_forward_33732843"
  },
  {
    "id": 2026080708,
    "word": "DR基准利率",
    "pinyin": "DR jī zhǔn lì lǜ",
    "field": "通用",
    "difficulty": "中",
    "pack": "每日热词",
    "publishedDate": "2026-08-07",
    "category": "财经",
    "simpleExplanation": "一种全新的“贷款利息标尺”，让企业贷款的利率能跟着市场资金松紧每天变。",
    "lifeAnalogy": "像租房从“每月固定价”改成“跟着小区行情浮动”，市场钱紧时贵点、钱松时便宜点，更贴合真实行情。",
    "practicalApplication": "企业贷款多了一个灵活定价选项，资金宽松时能更快降息；理财与融资时可对比LPR与DR，理解利率市场化改革。",
    "commonMisconception": "DR不是要取代LPR——二者互补分工，DR主要服务优质企业短期周转，房贷、消费贷等中长期仍锚定LPR。",
    "definition": "DR即存款类金融机构间债券回购利率，完全由市场交易生成；2026年8月多地落地DR基准利率贷款，贷款定价在LPR之外迎来更灵敏的“市场化新锚”。",
    "sourceUrl": "https://www.ce.cn/xwzx/gnsz/gdxw/202608/t20260806_3130447.shtml"
  },
  {
    "id": 2026080709,
    "word": "杠杆ETF",
    "pinyin": "gàng gǎn ETF",
    "field": "通用",
    "difficulty": "高",
    "pack": "每日热词",
    "publishedDate": "2026-08-07",
    "category": "财经",
    "simpleExplanation": "一种把股票涨跌放大两倍卖给你玩的基金，涨时赚翻倍、跌时也亏翻倍，风险很大。",
    "lifeAnalogy": "像借了钱去炒股，行情好赚得更多，一旦大跌不仅本金没了还可能倒欠，普通人不适合硬扛。",
    "practicalApplication": "投资者认清“双刃剑”属性，别把杠杆ETF当普通股票死拿；关注保证金和强平风险，理解韩国散户被“血洗”的教训。",
    "commonMisconception": "它不是专业机构的专利——在韩国大量散户持有，每日再平衡会机械追涨杀跌，波动被放大，极易触发强制平仓。",
    "definition": "通过衍生品把标的每日回报放大（如两倍）交易的基金；2026年7至8月韩国个股两倍杠杆ETF引发“杠杆踩踏”，超32万账户被强平，监管紧急抬高门槛降温。",
    "sourceUrl": "https://stock.jrj.com.cn/2026/08/05131158022056.shtml"
  },
  {
    "id": 2026080710,
    "word": "体外碎石",
    "pinyin": "tǐ wài suì shí",
    "field": "通用",
    "difficulty": "中",
    "pack": "每日热词",
    "publishedDate": "2026-08-07",
    "category": "健康",
    "simpleExplanation": "用冲击波从体外把肾结石“打碎”排出来的老办法，现在大医院不随便推荐了。",
    "lifeAnalogy": "像隔着墙拿锤子敲里面的石头，有时敲不碎还把墙震裂，不如开门进去精准取出更稳妥。",
    "practicalApplication": "查出结石别盲目碎石，先做CT或超声评估大小位置；大结石、有感染或肾下盏结石应听医生选输尿管软镜等微创手术。",
    "commonMisconception": "它并非“无创更安全”——反复碎石可能伤肾、形成石街或引发感染，部分人盲目碎石反而毁了肾功能。",
    "definition": "体外冲击波碎石术（ESWL），用冲击波从体外粉碎泌尿系结石；2026年8月多家医院提醒其有严格适应症与伤肾风险，大结石和感染患者更宜选输尿管软镜等微创术。",
    "sourceUrl": "https://health.baidu.com/m/detail/ar_6373829742317221660"
  }
]